,title,category,intro,url
4159,"유기견 추운 겨울나기, '방구석댕댕이' 뱃지&스티커",잡화,추운 겨울 버려진 아이들에게 따뜻한 방구석의 온기를 느끼게 해주고자 기획한 프로젝트입니다.,https://tumblbug.com/bangkuseok
4160,테일즈위버를 담은 액세서리,잡화,홍휘아화만의 감성으로 테일즈위버의 각 캐리터별 이미지를 담아 액세서리로 만들었습니다.,https://tumblbug.com/honghwiahwa
4161,젊은 감각의 고깃집,웹툰 리소스,왕조기의 스케치업 웹툰 배경!! 1탄 - 젊은 감각의 고깃집,https://tumblbug.com/kmthony_001
4162,"[웹툰 스케치업] 물의도시 베네치아, 궁전과 도심지",웹툰 리소스,현대물과 로판 등 다양한 장르에 사용 할 수 있는 웹툰 배경입니다.,https://tumblbug.com/flcvenice
4163,재밌는 힐링타임! 문질러 녹이는 아이스크림 멜팅캔들 멜팅바,홈 · 리빙,어린 날의 소꿉놀이를 닮은 멜팅캔들로 지친 현대인에게 힐링시간과 소소한 행복을 선물합니다.,https://tumblbug.com/thejisz_meltingbar
4164,"여름을 기다리는 모두에게, 완벽한 린넨 로브",의류,불필요한 부분은 생략하고 필요한 부분은 추가한 웰메이드로브. 우리에게 필요했던 진짜 로브.,https://tumblbug.com/unknown_robe
4165,전통 와당으로 현대를 장식하다 : 와당 노리개와 키링,잡화,와당을 현대적으로 재해석해 만든 키링과 노리개 장식 ,https://tumblbug.com/llt
4166,고민없이 편하게 외출하세요! 실용성 최고 '솝솝백',잡화,우리 후원자님들 넣고 싶은거 다 넣으실 수 있도록 만든 '솝솝백',https://tumblbug.com/sobsob
4167,인생장사학교 캠프로 나만의 내일가게 기획하기,푸드,누구나 퇴사를 꿈꾸고 장사를 고민합니다. 나만의 가게를 멘토들과 함께 기획해보는 실전 캠프,https://tumblbug.com/injangsa
4168,"100% 벌집 숙성꿀, 어반비즈 청크 허니",푸드,꿀벌들의 힘으로만 만들어진 천연벌집과 숙성꿀을 담았습니다.,https://tumblbug.com/ubs_chunkhoney
4169,만질 수 있는 리얼 패션 소재 북 [ 더 텍스타일 ],출판,패션피플을 위한 리얼 원단 소재 북 탄생! 그동안 궁금했던 소재정보를 실물로 만나 보세요.,https://tumblbug.com/thetextile
4170,"잊혀진 제국의 꽃으로 봄을 맞이해요 _ 오얏꽃 뱃지,귀걸이",잡화,조선제국 황실의 상징이자 국장이었던 오얏꽃! 잊혀진 제국의 꽃으로 다가올 봄을 기다려요,https://tumblbug.com/ooooq_koraphicseries_2
4171,"세상 모든 색깔을 담은 카드, <코스믹 컬러 카드>",보드게임 · TRPG,"타로제로 김원장이 직접 만들고, 타로와 색채 심리 상담에 활용 가능한 66장의 컬러 카드",https://tumblbug.com/cosmiccolorcards
4172,불로소득을 희망하는 <내 꿈은 건물주> 뱃지,잡화,조물주 위에 건물주,https://tumblbug.com/i_want_building
4173,이쁘다고 비쌀필욘 없잖아!! 두번째 이야기 '스탠드버킷백',잡화,잘 나온 디자인이라고 꼭 비쌀필요 있나요? 'STAND OIL'은 예쁘고 합리적입니다.,https://tumblbug.com/standoil2
4174,도사와 도술이 난무하는 TRPG [설화학당],보드게임 · TRPG,Team.오소리굴의 첫번째 프로젝트! 한국형 현대 도술학교 TRPG 설화학당입니다.,https://tumblbug.com/sullhwa_hackdang
4175,"월경컵 입문자를 위한 사용 안내서,〈안녕 월경컵〉",출판,고르는 방법부터 사용 후 관리까지. 필요한 내용만 알차게 담아낸 월경컵 입문서,https://tumblbug.com/hellocups
4176,"'한잔하개?' 메시지각인 강아지 찻잔,술잔",홈 · 리빙,"토닥토닥- 오늘도 수고했어, 따듯한 응원의 메세지를 전해주는 반려견 찻잔",https://tumblbug.com/sosojagi
4177,"아름다운 작별의 후유증 ,고요 <<환상과 상멸>>",출판,[환상]과 [상멸]은 각자에게 남은 후회와 상처를 저의 언어로 기록한 시집입니다.,https://tumblbug.com/goyoandbell
4178,스케치업 웹툰배경 추모의 흐름2 공동묘지,웹툰 리소스,추모의 흐름 두번째 입니다. 지난 펀딩과 다른 추모와 관련된 장소들입니다.,https://tumblbug.com/toonmake10
4179,"비에 젖은 숲과 백장미가 놓여있는 침실, 그 공간의 향",향수 · 뷰티,비에젖은 숲과 백장미화원의 공간을 뿌려보세요!,https://tumblbug.com/chipmunk_fg
4180,"해외 영화 속 샌드위치 모음, 『영화 속 샌드위치 도감』",출판,1980년대부터 2010년대의 해외 영화에 등장한 샌드위치 장면을 수집한 도감입니다.,https://tumblbug.com/thebookofmoviesandwiches
4181,'두근두근' 달달함 듬뿍 <구름껴도맑음> 캘린더,디자인 문구,"두근두근, 달달한 '그 사람' 처럼 항상 곁에 두고 싶은 2017 일러스트 캘린더",https://tumblbug.com/2017
4182,모든 요리 마라롭게! <만능 마라소스 &마라떡볶이>,푸드,모든 요리 마라롭게! 단 한스푼으로 마라맛 뿜뿜하는 환상의 마라소스,https://tumblbug.com/malasauce
4183,[베들레헴 올리브나무] 토마스 만년필,디자인 문구,베들레헴에서 자란 올리브나무로 제작한 만년필 입니다.,https://tumblbug.com/thomas
4184,전휘목의 크리스마스 엽서 카드 2016,예술,크리스마스 엽서 카드로 소아암 병동 어린이들에게 힘을 주세요 ㅅ.ㅅ!!,https://tumblbug.com/christmas2016
4185,당신이 부자가 되었으면 좋겠어요,출판,전업 주부였던 저자가 들려주는 돈과 부동산에 대한 솔직한 이야기.,https://tumblbug.com/ic7960
4186,"숲 만드는 반려나무 입양 키트, 백두대간 멸종위기종 에디션",반려동물,반려나무 한 그루를 입양하면 한반도 멸종위기 식물 한 그루를 백두대간에 심어드립니다.,https://tumblbug.com/mytreeplanet03
4187,선탠 후르츠 밀크 글라스,홈 · 리빙,껍질을 벗고 선탠 하고 있는 과일들이 그려진 밀크글라스 입니다.,https://tumblbug.com/suntanfruits
4188,300명을 위해 천천히 고민한 'OOO 체크자켓',의류,가격 거품을 걷어낸 'OOO 체크자켓' 입니다.,https://tumblbug.com/checkjacket
4189,한국형 저승 판타지 소설 <달에서 내려온 전화>,출판,"한달에 두번, 저승과 연결된다. 달에서 내려온 붉은줄. 당신은 어떤 얘기를 나누시겠습니까?",https://tumblbug.com/geuljimazsecfiction
4190,작업자의 옷 <PaTI 워크점프수트>,의류,"담백하게 예쁜 점프수트 작업복을 찾는 분들을 위한, 마감이 꼼꼼한 봄/가을용 점프수트입니다",https://tumblbug.com/pati_jumpsuit
4191,우리는 맛있는 커피를 마실 권리가 있습니다.,푸드,"우리는 합리적인 가격에 맛있는 커피를 만들고 싶었고, 결국 만들었습니다.",https://tumblbug.com/brewsbrothers2
4192,아르쉘레나의 스케치업 공유 프로젝트#1 (시골집/병원로비),웹툰 리소스,기존에 제가 쓰려고 제작한 스케치업 배경을 공유하고 싶어 이번 프로젝트를 준비하였습니다.,https://tumblbug.com/anierulsuga
4193,2019 포인핸드 유기견 사진전시회 기념 캘린더,디자인 문구,2019년 IKEA 광명점에서 열리는 포인핸드 유기견 사진전시회 기념 한정판 캘린더입니다.,https://tumblbug.com/pawinhand6
4194,당신에게 딱 맞는 사고성향별 다이어리,디자인 문구,"나의 사고성향에 딱 맞게 조합하여 사용하는 사고성향별 다이어리, MY-LAB 저널입니다.",https://tumblbug.com/progominler_mbti_journal
4195,낭만적인 연출이 가득한 강변다리 상가,웹툰 리소스,"대형강변다리와 작은다리, 상가지구로 구성된 낭만적인 연출이 가득한 강변다리 상가",https://tumblbug.com/mongtori_4
4196,스케치업 배경 - 마법사 길드,웹툰 리소스,"스케치업 프로젝트 1탄, 마법사 길드입니다.",https://tumblbug.com/170717sdg
4197,"봄 제주, 유채꽃을 담은 봄맞이 귀걸이 3종",주얼리,"봄의 제주, 그 속의 유채꽃을 갈망하며 쥬얼리를 만들었습니다.",https://tumblbug.com/wootique_rapeflower
4198,"무속신앙, 넋두리, 퇴마와 달램의 이야기 '녹명당 1권'",출판,"무속신앙의 나라 이선. 굿, 살풀이, 민간신앙을 녹여낸 달램에 관한 용과 인간의 환상소설.",https://tumblbug.com/nokmyong
4199,쉬움 주의. 폴라베어 페이퍼 커팅 KIT,홈 · 리빙,컬러링 북보다 쉬워요. 생각없이 즐기는 새로운 취미! 페이퍼 커팅을 소개합니다.,https://tumblbug.com/soomkki02
4200,기억을 잃은 아빠를 바라보는 아들의 사진일기,출판,알츠하이머 치매 진단을 받은 아버지를 바라보며 기록한 사진과 글이 담긴 사진책,https://tumblbug.com/ourseasons
4201,"MZ세대의 선한 영향력을 위한 착한 경매 플랫폼, 플리옥션",테크 · 가전,"기증받은 물품을 경매하고, 발생한 수익금은 기부하는! 최초의 착한 경매 플랫폼",https://tumblbug.com/fleaauction
4202,2019 죽도록 하고 싶은거 하나라도 잘해보자!킬미 캘린더,디자인 문구,2019년에는 고민고민 하지말고 킬미캘린더와 함께 하나라도 제대로 합시다.,https://tumblbug.com/killmecal
4203,<제주 바다-월정리 해변>웹툰 스케치업 배경,웹툰 리소스,제주 바다 중에서 가장 사랑받는 월정리 해변을 웹툰 스케치업 배경으로 제작했습니다.,https://tumblbug.com/jejusweep
4204,[우주향수 갤럭시] 은하계 가득한 보랏빛 우주 먼지의 향기,향수 · 뷰티,문득 '나'라는 존재는 먼지보다도 더 작은 하찮은 존재라는 생각이 들기도 한다...,https://tumblbug.com/galaxyspacedust
4205,향긋함 그대로 한팩에 담은 간편한 수제청:코디얼,푸드,효능은 좋지만 대중화되지 않은 꽃청 저희가 직접 꽃과 당신의 아름다움을 알리려 합니다.,https://tumblbug.com/floblendi_
4206,엄지검지 핑거리스 장갑,잡화,지문인식이 가능한 엄지 검지 핑거리스 장갑,https://tumblbug.com/fingerless
4207,"꿀잠 한 스푼, 가벼운 일상<슬립 웰 필로우 미스트>",향수 · 뷰티,"숙면 전도사가 된 불면증 환자의 이야기, 우리에게 잠이 왜 중요한지 철학적으로 풀어낸 향기",https://tumblbug.com/sleepwellpillowmist
4208,"[발렌타인데이]벨기에식 수제 초콜릿, '부록하우스 쇼콜라'",푸드,벨기에에서만 먹을 수 있는 벨기안 수제 초콜릿을 후원자분들에게 소개시켜드리려고 합니다.,https://tumblbug.com/brockhaus
4209,"내가 만든 어버이날 선물, <엄마 안내서 & 아빠 안내서>",출판,"사랑하지만 표현 못 하는 우리들을 위한, 그리고 우리 엄마 아빠를 위한 따뜻한 책입니다",https://tumblbug.com/letmetellyoumy
4210,"발을 감싸는 고급스러운 편안함, 이태리 램스판 삭스부츠",잡화,플러터 수제화는 40년 경력의 단단한 장인의 손으로 만들어지는 천연 가죽 슈즈입니다.,https://tumblbug.com/fluttersocksboots
4211,5구5구 한입줄까?,푸드,5가지맛 수제 초콜릿이 5구상자에!,https://tumblbug.com/mitsunocacao16
4212,"우리 모두의 외로움을 위해, <일인분의 외로움>",출판,오휘명 작가의 산문집입니다. 각자가 지닌 외로움에 관한 고찰과 소소한 단상들을 담았습니다.,https://tumblbug.com/eachloneliness
4213,자투리 무스탕 활용 프로젝트-천연 무스탕 손모아장갑,잡화,"한마리의 양이라도.. 덜 키우고 ..덜 도축하면.. 뭐라도 ""쫌"" 나아지지 않을까요?",https://tumblbug.com/uklamb3
4214,내 곁에 오래오래 친구가 되어 줄 '단정한 체크 울코트',의류,좋은 소재와 심플하고 클래식한 디자인으로 오래오래 친구처럼 함께 하는 코트를 만들었습니다.,https://tumblbug.com/checkwoolcoat
4215,드라마엔 없는 리얼이야기 <현실에 그런 비서는 없습니다>,출판,비서가 알려주는 현실 속 비서 이야기. 드라마엔 안 나오는 비서들의 리얼 스토리,https://tumblbug.com/realsecretarystory
4216,빈티지함이 가득한 나만의 홈카페 [오키프 스튜디오],홈 · 리빙,빈티지함이 가득한 나만의 홈카페. 월넛 사각 트레이와 빈티지 유리컵입니다.,https://tumblbug.com/okeeffstudio
4217,평생쓰는 1200마리의 고양이 소스,웹툰 리소스,1200마리의 고양이 자료 입니다.,https://tumblbug.com/joie
4218,"내 책 크라우드 funding 노하우 PDF, 파일 패키지",출판,150명 이상의 작가와 함께한 출판 플랫폼 노마드로그에서 책 펀딩 노하우를 전달합니다.,https://tumblbug.com/publishcrowd
4219,"티 소믈리에의 '집에서 떠나는 프랑스 여행, 마실the'",푸드,티즌X경희대 프랑스어학과 / 무카페인 티포가토부터 보르도의 와인까지 전문가가 만든 블렌딩티,https://tumblbug.com/masilthe
4220,SALON DU CHOCOLAT 2019: 다시 보기,푸드,2019년 살롱 뒤 쇼콜라에서 소개된 초콜릿들을 안방에서도 만나보세요 :),https://tumblbug.com/salonduchocolat2019
4221,커피 한 잔 값으로 독립출판 책만들기,출판,"커피 한 잔 값으로 독립출판 책만들기 프로젝트! 책 기획부터 디자인, 인쇄까지 담았습니다.",https://tumblbug.com/dawnsense
4222,"옛 책가도에 담긴, 오늘 당신의 취향 <비단백>",잡화,"옛사람들의 취향을 담던 책가도, 오늘날 당신의 고귀한 취향을 담아",https://tumblbug.com/yourtaste
4223,잿불 속의 군단/프로키온의 무법자들,보드게임 · TRPG,어둠속의 칼날 엔진을 사용한 RPG <젯불 속의 군단>과 <프로키온의 무법자들>,https://tumblbug.com/fitd
4224,"책상 위 나만의 마을, '빌리지' 오거나이저",홈 · 리빙,"사용자가 취향대로 꾸미고, 능동적으로 조합할 수 있는 데스크 오거나이저 '빌리지'.",https://tumblbug.com/boinda
4225,"봄을 준비하는 ""클립형 담수진주 귀걸이""",주얼리,귀를 뚫지 않아도 귀걸이를 할수있어요. 귀를 잠깐 쉬게해주는건 어떨까요?,https://tumblbug.com/silverlatte2
4226,귤냥이 & 귤알냥의 귀여운 합체,캐릭터 · 굿즈,여러분의 마음을 정복하기 위해 귀여움으로 무장한 귤냥이와 귤알냥이를 만나보세요!,https://tumblbug.com/gyulnyangi
4227,[공식] 부농부농 내 몸속에 모두 저장! 핑크빈 파우치,잡화,부농부농 핑크빈 파우치가 여러분 곁에 찾아 왔습니다.,https://tumblbug.com/pinkbinbag
4228,"다시 돌아온 여름 핵인싸템, PVC 릴리 파우치",잡화,"작년 여름, PVC 립 파우치 '리립'이 더 발전된 모습으로 돌아왔습니다!",https://tumblbug.com/lilypouch
4229,스케치업 : 도서관,웹툰 리소스,스케치업을 통한 웹툰 배경 도서관,https://tumblbug.com/ltravel01
4230,"City Portraits, 가까이서 바라본 도시의 모습",사진,도시의 눈높이에서 바라본 도시. <City Portraits> 엽서책과 포스터 세트,https://tumblbug.com/cityportraits
4231,하얀 쥐 '데이지' 베이커리 그림책 출판하기,예술,작고 사랑스러운 하얀쥐 '데이지'가 꾸린 베이커리에서 일어나는 일을 동화책으로 엮습니다.,https://tumblbug.com/daisybakery
4232,"맞춤형 심리분석 다이어리, 마음다방",디자인 문구,나의 마음을 위로하는 아주 특별한 다방으로 당신을 초대합니다.,https://tumblbug.com/mamda
4233,한국을 떠나려 하는 이에게 <그래서 네덜란드로 갔어>,출판,꿈을 향해 달렸던 이야기! 실패와 좌절도 했지만 좋은 일도 가득했던 네덜란드 살이 에세이,https://tumblbug.com/sonetherlands
4234,Stop&Stretch! 몸과 마음에 쉼을 선물하는 티셔츠,의류,"이 티셔츠는 분주한 일상에서 잠깐 멈추어, 몸도 마음도 쉬어가자는 제안을 담고 있어요 ",https://tumblbug.com/stop_stretch
4235,씨흙을 더해 빚어 낸 씨드 플레이트,홈 · 리빙,씨흙을 새로운 흙과 반죽해 그릇을 빚습니다.,https://tumblbug.com/seoulbada
4236,"전통이 힙하다, 모던한 전통문양 한:멋 양면허리치마",의류,고려나전문양과 봉황반자문양을 텍스타일로 디자인하여 양면으로 착용가능한 허리치마로!,https://tumblbug.com/hanmut_skirt
4237,애쉬크로프트의 <헨리 치나스키> 안경 2019 Ver.,잡화,찰스 부코스키의 소설 'FACTOTUM'에서 영감을 받은 날것의 안경.,https://tumblbug.com/henrychinaski2019
4238,마라탕 덕후 굿즈,디자인,"최고존맛 마라탕을 사랑하는 마음으로 만든 굿즈(금속뱃지, 엽서, 스티커)입니다.",https://tumblbug.com/malatang
4239,배트맨 80주년 기념 아트북- 다크 나이트의 모든 것,출판,배트맨의 히스토리를 총망라한 다크 나이트의 모든 것: 배트맨 80주년 기념 아트북 프로젝트,https://tumblbug.com/batmanartbook
4240,수달을 피해 도망쳐!! '산천어의 여정' 보드게임,보드게임 · TRPG,"수달을 피해 도망가!! 화천 산천어 축제를 모티프로 만든 보드게임, 산천어의 여정입니다.",https://tumblbug.com/morooedu
4241,은근슬쩍 전하는 속마음 '메시지티 Message Tea',푸드,꽃차와 함께 전하는 은근한 속마음,https://tumblbug.com/flow_er
4242,똘망똘망 다람이 무릎담요,캐릭터 · 굿즈,똘망똘망 다람이 무릎담요를 제작합니다.,https://tumblbug.com/chipmunkblanket
4243,칭찬받는 기획서는 알고리즘이 다르다,출판,기획서를 잘 쓰고 싶다면 지금 당장 기획서 작성 알고리즘을 만들어보세요.,https://tumblbug.com/swingjazz2
4244,"에코백과 샤코슈백의 만남, ""데일리 에코슈백""",잡화,기존의 샤코슈백에서 가을의 감성을 더한 '에코슈백'을 기획하였습니다. 많이 기대해주세요:),https://tumblbug.com/paletteecoche
4245,사막화와 냄새를 막아주는 청정 고양이화장실<레이스하우스>,반려동물,"고양이와 집사를 위한 맑은 공기 쾌적한 고양이 화장실, 야옹씨 레이스 하우스입니다.",https://tumblbug.com/mrmeow
4246,시간만 야속하게 흘러간 적이 있는 분들에게 '낮과밤 3쇄',출판,당신의 낮과 밤은 어떤 문장으로 채워져있나요?,https://tumblbug.com/1984books
4247,"강렬한, 날것 그대로의 우리 여신 이야기『아무달 아무날』",출판,"아주 먼 옛날, 아무달 아무날 전해진 여신들의 이야기를 전하는 출판 프로젝트",https://tumblbug.com/damdam
4248,데끼르 데끼르 니홍고,출판,일상생활에서 쉽고 재밌게 쓸 수 있는 단어들로 이루어진 일본어 학습책을 만들고자 합니다,https://tumblbug.com/41817
4249,[춘천일기] 우린 춘천에 가기로 했다 with 수아마노,출판,단순한 재료로 깊은 풍미를 내는 이탈리아 요리 한 접시처럼 소박하지만 진심을 담은 에세이,https://tumblbug.com/wedecidedtogotochuncheon
4250,sns보다 쉬운 시쓰기 시;톡,출판,이대흠 시인의 시;톡에서만 알려 주는 5가지 TIP,https://tumblbug.com/book1
4251,[페미니즘 에코백] 우리의 목소리는 더 높아져야 합니다,잡화,우리의 목소리는 더 높아져야 합니다. 여기에 작은 일로나마 보탬이 되고자 합니다.,https://tumblbug.com/ourvoice
4252,레고 타자기를 블루투스 키보드로 만들기,테크 · 가전,레고 타자기를 진짜 블루투스 키보드로 만들어 봅니다.,https://tumblbug.com/lego-tw-bt-key
4253,'허리치마'로 피워낸 당신을 위한 '동백꽃',의류,"고운 '동백꽃' 자수를 담고, '편안함'을 더한 '동백 허리치마'",https://tumblbug.com/yeonbit21
4254,낭만 한 스푼 <마이 리틀 피크닉 향수 세트>,향수 · 뷰티,"향기로 기억되는 나의 작은 감성 피크닉, 당신의 향기롭던 피크닉을 회상해 보아요",https://tumblbug.com/mylittlepicnic
4255,여행 실종 시대에 대처하는 여행잡지 트래비 15주년 특집호,출판,아무도 여행을 할 수 없는 초유의 사태에 대처하는 여행잡지 <트래비>와 여행작가님들의 자세,https://tumblbug.com/travie
4256,[툰툰마켓] #3 웹툰 배경을 위한 계절 브러쉬 모음,웹툰 리소스,스케치업 웹툰 배경 활용도를 200% 끌어올릴 수 있는 마법 같은 계절 브러쉬 모음,https://tumblbug.com/ttm03
4257,자긍심으로 똘똘 뭉친 퀴어한 무지개 고양이들,캐릭터 · 굿즈,자긍심으로 똘똘 뭉친 퀴어한 무지개 고양이들을 뱃지로 만나보세요.,https://tumblbug.com/rainbow_cats
4258,"'역사의 방아쇠'를 당긴 페미니즘의 고전, <여성의 신비>",출판,"'역사의 방아쇠'를 당긴 페미니즘의 고전, 50주년 기념판 출간",https://tumblbug.com/femininemystique
4259,스투페오 2019.1.26 신년콘서트,음악,첼로만으로 듣는 클래식! 스투페오(Stupeo)의 콘서트에 여러분을 초대합니다.,https://tumblbug.com/stupeoconcert
4260,"따뜻한 겨울을 함께할 270g의 가벼움, 이태리가죽 수제화",잡화,플러터 수제화는 40년 경력의 단단한 장인의 손으로 만들어지는 천연 가죽 슈즈입니다.,https://tumblbug.com/flutterboots
4261,레진코믹스 인기연재작 <킹스메이커> 단행본 애장판,웹툰 · 만화,"[오 마이 갓!] 강지영, [공주는 잠 못 이루고] 하가 작가가 선보이는 BL 판타지!",https://tumblbug.com/kingsmaker
4262,"""물""보다 깨끗한 반려견 샴푸 에브라함식스 페코케어",반려동물,세계 최초로 유용미생물 파나셈 원료를 사용한 물보다 깨끗한 샴푸 페코케어 입니다.,https://tumblbug.com/abraham6pecocare
4263,"취준생을 위한 세상에서 단 하나뿐인, 취존감 다이어리",디자인 문구,"취준생들의 자존감을 지켜줄 유일한 취업준비용 다이어리, 힘든 취준생활을 함께해줄게요!",https://tumblbug.com/cjgdiary
4264,"가을에 즐기는 여름 한스푼, 자두가 70% 들어간 자두잼",푸드,"여름, 그 계절의 맛을 그대로 담아낸 수제 자두잼이에요. 직접 농사지은 자두로 만들었어요.",https://tumblbug.com/solchan_i
4265,한눈에 보이는 무료 글꼴 가이드 (한글판),출판,한글 무료 글꼴에 대한 체계적인 정보를 제공하고 그 활용 방법을 제대로 알려드립니다.,https://tumblbug.com/fontbook
4266,"시작의 무지개, 여덟개의 색을 '마주치다'",잡화,여덟개의 색을 가진 무지개 악세사리를 하고 미래를 바라보는 희망에 대해서 이야기합니다.,https://tumblbug.com/majuchida
4267,The Legend of Gockgang-E,디지털 게임,The King of Gockgang-E 시리즈의 세번째 후속작.,https://tumblbug.com/the_log
4268,<송오와매선> 한국 전통 매듭에 힙을 입히다.,잡화,"전통매듭의 변신, 자유분방하고 힙한 스타일로 재해석한 요즘 장신구 <송오와매선>",https://tumblbug.com/songowamaeseon
4269,"스케치업 웹툰배경 ""학교 가는길(공원)""",웹툰 리소스,학교가는 길을 주제로 학교앞 거리와 공원을 주요포인트로 제작하였습니다.,https://tumblbug.com/plone4
4270,최신 로컬 인사이트가 모두 여기에 <로컬 전성 시대>,출판,로컬 비즈니스 최전선에서 활발히 활동하는 32명의 이야기를 소개합니다.,https://tumblbug.com/iknowhere_locallifestyle1
4271,[앙영] 조금 더 다양한 사람들을 위한 '시저후드티',의류,#후드티 #오버핏 #드롭숄더 #기모 #넉넉한품 #편안해요 #펭귄자수,https://tumblbug.com/caesarhoody
4272,잔망루피 2022 시즌 그리팅 다꾸세트,디자인 문구,"2022년, 잔망루피와 함께 잔망스러운 한 해를!",https://tumblbug.com/zanmangloopy_2022
4273,환상의 낙원 무릉도원에서 불어오는 복숭아향기 '피치블라썸',향수 · 뷰티,예쁘게 핀 복숭아꽃의 산뜻함과 사랑스러움이 담겨있는 '피치 블라썸'을 소개합니다.,https://tumblbug.com/cqjr_peachblossom
4274,한국의 자연을 담은 [한국의 향] 디퓨저와 드롭퍼,홈 · 리빙,한국 곳곳의 이야기를 알리고자 지역의 특색을 담은 한국의 향을 개발하였습니다.,https://tumblbug.com/chiprojectseoul_7
4275,FAKER _파란 거짓말,보드게임 · TRPG,'AHAHA Kingdom' 최고의 페이커를 가리는 경기가 시작됩니다 !!!,https://tumblbug.com/faker
4276,겹쳐쓰는 [알파벳] 그림자 스티커,캐릭터 · 굿즈,"3D로 만든 듯 입체적인, 겹쳐쓰는 [알파벳] 그림자 스티커",https://tumblbug.com/shadowsticker
4277,[1SCOOP프로젝트] 영롱함을 가득 담은 은침 달 귀걸이,주얼리,1SCOOP(원스쿱)은 영롱함을 담은 달 귀걸이를 이번 프로젝트의 모티브로 삼았습니다.,https://tumblbug.com/1scoop
4278,단 7일! 화이트데이엔 ‘레드/화이트 뱅쇼 선물세트',푸드,"세상 가장 달달한 선물, '레드/화이트 뱅쇼 세트'로 당신의 특별한 하루를 만들어 보세요.",https://tumblbug.com/yourhomecafe7
4279,"세상에 단 하나뿐인, 새로운 방향성의 미니멀리즘 인센스홀더",홈 · 리빙,나무 고유의 따뜻함과 섬세한 손길이 만나 탄생한 수공예 인센스홀더입니다,https://tumblbug.com/woothic
4280,"내 손으로 만드는 밀크티, 오리지널 & 스트로베리",푸드,내 손으로 만드는 인생 밀크티,https://tumblbug.com/brewsbrothers06
