,title,category,intro,url
0,사악한 주술이 가득한... 의식의 서,보드게임 · TRPG,사악한 주술이 가득한... 의식의 서,https://tumblbug.com/ritualbook
1,"한국왕실 고양이 트럼프 카드 <묘화>와 일러스트북,틴케이스",보드게임 · TRPG,여러 게임이 가능한 한국풍 왕실 모자와 머리스타일로 그린 고양이 플레잉 카드입니다. ,https://tumblbug.com/catflower
2,데뷔 못 하면 죽는 병 걸림 1차 공식 굿즈,출판,"[KW북스] 백덕수 작가님의 '데뷔 못 하면 죽는 병 걸림' 첫 번째 공식굿즈, 마법소년.",https://tumblbug.com/testar_official_1st_goods
3,어느 여행자가 남긴 <<판타지 설정 도감>>,출판," 판타지 세계의 식자재, 무기는 물론 다양한 종족과 동식물의 설명으로 가득합니다.",https://tumblbug.com/fantasyart
4,교회의 '금기와 편견'을 깨고 나온 <퀴어 성서 주석 2>,출판,"교회의 금기와 편견을 깨고 나온 성서 해설서, <퀴어 성서 주석 2. 신약 성서>.",https://tumblbug.com/qbc2
5,프리랜서 작가로 한 달에 400~1000만 원 버는 법,출판,프리랜서 작가 실전 노하우와 팁 / 모든 글쓰기 분야 작법 설명 / 정확한 페이 계산 ,https://tumblbug.com/aronsong5
6,타로와 점성술의 조합 '별 타로카드 PRO',디자인,"타로카드에 별자리, 행성, 원소 기호를 추가하여 다방면으로 활용할 수 있는 새로운 타로 덱",https://tumblbug.com/pro
7,"기독교 대천사부터 본디에이의 천사까지, <천사소개록> ",출판,"기독교, 유대교 전설, 이슬람 천사들과 '본디에이의 천사들'이라 불리는 부두교 로아의 기록",https://tumblbug.com/angelus
8,20대 여자 : 부유하는 심판자들,출판,238개 문항의 대규모 웹조사로 살펴본 '20대 여자'라는 새로운 정치세력,https://tumblbug.com/twenties
9,500가지 기호와 상징 <SYMBOLS> 심볼 사전,출판,"수천 년의 인류 역사에 걸쳐 500개가 넘는 기호, 상징
고대 천문학부터 마법 악마학까지 ",https://tumblbug.com/symbols300
10, 게으른 완벽주의자들을 위한 플래너 <데일리 처방전>,디자인 문구,"'완벽하려다 아무것도 못했다'라는 말은 그만-
하루 한 장, 데일리 처방전과 함께 해요.",https://tumblbug.com/dailyprescription
11,문 시놉시스 : 웹소설 작가가 만든 하이퍼링크 시놉시스,출판,"웹소설은 물론 스토리텔링이 필요한 모든 곳에, 아마추어부터 프로작가까지 하이퍼링크 시놉시스",https://tumblbug.com/moonsynopsis
12,러시아 아방가르드의 이론과 실제 : 말레비치와 그의 학파,출판,면면히 살펴보는 말레비치와 20세기 러시아 아방가르드 예술가들의 작품과 삶의 이야기!,https://tumblbug.com/malevich
13,당신의 운명을 정하는 [YES/NO] 코인,예술,운명의 [YES/NO] 코인,https://tumblbug.com/yes-no_coin
14,"따뜻한 차 한잔의 여유, 요나폿의 애프터눈 티 세트",푸드,요나폿과 함께하는 오후의 티 타임 ,https://tumblbug.com/jonapot12
15,오픈월드형 스토리텔링 보드게임 [슬리핑 갓즈 한국어판],보드게임 · TRPG,이제 기나긴 항해의 서막을 올릴 시간입니다. 슬리핑 갓즈 보드게임 정식 한국어판,https://tumblbug.com/sleepinggods
16,웹툰&일러스트 꽃과 과일 장식 브러쉬,웹툰 리소스,"웹툰, 일러스트를 빠르고 화려하게 꾸며줄 꽃과 과일 위주로 구성된 장식 브러쉬 세트입니다.",https://tumblbug.com/22020571
17,우리나라 역사 속 하늘세계로<찬란한 우리 천체 이야기-상>,출판,"우리나라 역사 기록 속 신비한 천문 이야기와 별자리 점괘, 설화를 모두 소개하는 책입니다.",https://tumblbug.com/koreauniverse
18,대장정의 마지막! <가담항설> 오디오 웹툰 드라마 시즌3,웹툰 · 만화,네이버웹툰 <가담항설>의 오디오 웹툰 드라마 마지막 시즌!,https://tumblbug.com/gdhsseason3
19,"월간커피, 군밤과 군고구마 같은 겨울 간식 콜드브루 커피",푸드,'월간커피'라는 이름으로 매달 새로운 싱글 오리진 콜드브루 커피를 한정수량으로 선보입니다.,https://tumblbug.com/brewsbrothers49
20,"따뜻하고 아름다운 힐링 판타지, <소원을 이루어주는 섬>",출판,행복의 섬을 찾아가는 각기 다른 아픔을 가진 이들의 이야기,https://tumblbug.com/hiddenisland
21,중등수학부터 고등수학까지 한번에 정리한 <수포의 공식집>,출판,졸업/입학/새학기 최고의 선물 <수포의 공식집>: 우리들 가방속 필수 아이템!!!,https://tumblbug.com/gozipmath_1
22,"고전에서 발굴한 해몽 기록, <꿈보다 해몽> 도감 ",출판,오랜 역사서와 민간 자료에서 꿈 이야기를 모아 해몽 도감을 발간합니다.,https://tumblbug.com/dreaminterpret
23,왕이 사랑한 보석같은 궁중디저트를 선물합니다. ,푸드,왕이 사랑했던 보석같은 우리의 전통궁중병과를 여러분께 선물합니다. ,https://tumblbug.com/wolmyo
24,올해도 함께 하고 싶은 사람에게 [멜랑 기프트 세트],푸드,멜랑이와 함께 말랑한 새해를 보내보세요!,https://tumblbug.com/melan9
25,"화려한 제복의 시대 ""그림으로보는 대한제국의 군복""",출판,대한제국의 화려한 서양식 군복들을 한권에 담았습니다.,https://tumblbug.com/uniformkorea
26,기다리고 기다렸다! 창작자를 위한 테크웨어 브러쉬 ,웹툰 리소스,"벨트, 사슬, 스터드, 레터링, 디스트로이 진, 아일렛 등 148 종 테크웨어 모음",https://tumblbug.com/uniz_
27,[설 전 배송]조선클래식의 시작! 대창의 백운코트,의류,"[설 전 배송]울 100% 상의원의 손길로 만든 조선클래식의 시작, 대창의 백운코트",https://tumblbug.com/baekuncoat
28,동남아 향취를 가득 담은 '미얀마 코코넛밀크 국수' 밀키트,푸드,"커리향 가득한 코코넛밀크 소스에, 맛있는 달걀면을 함께? 간편하게 먹는 진짜 미얀마 음식!",https://tumblbug.com/chilluchillu_1
29,19세기 말 런던의 금수양복점 <금수를 위한 의복가이드>,출판,"19세기 말 런던, 가상의 양복점을 배경으로 한 이야기 동물 손님들과 인간 양장사의 이야기",https://tumblbug.com/clothing_guide_for_animals
30,글감옥 두 번째 작품집 <글감옥 수감일지 vol.2>,출판,글을 쓰고 싶어서 스스로 감옥에 갇힌 25명의 이야기를 담았습니다.,https://tumblbug.com/writing_prison2
31,아름다움의 공감 <아칸서스 그리고 능화 실버 주얼리> ,주얼리,"VOVODAVIN 주얼리 팀의 첫 프로젝트 , 서양의 아칸서스와 동양의 능화의 만남 ",https://tumblbug.com/vovodavin
32,관점을 바꾸는 그림시 <뻐끔뻐끔>,출판,난 너를 사랑하지만 우리는 참 소통이 안돼_'저주받은 커뮤니케이션',https://tumblbug.com/redentertainment
33,5.18 민주화운동 애니메이션 <운동화 비행기>,영화 · 비디오,그림책 <운동화 비행기>를 원작으로 아름답고 숭고한 민주주의 정신을 담은 단편 애니메이션,https://tumblbug.com/518animation
34,세상에 없던 새로운 수채화 다이어리,디자인 문구,일상 속에서 간편하게 그림 그리는 수채화 다이어리,https://tumblbug.com/artable
35,방안을 가득 채울 수 있는 풀장: [프룸] 인센스 홀더,홈 · 리빙,풀장에서 모티브를 딴 인센스 홀더 [프룸]은 방안을 향으로 가득 채울 수 있는 풀장입니다.,https://tumblbug.com/prooml
36,살짝... 설렜을지도... 다 함께 메이킹 BL ~학원편~,보드게임 · TRPG,이렇게 불끈한 플레이는 처음이야. 어느 고등학교에서 펼쳐지는 두근두근 위험한 학원 로맨스!,https://tumblbug.com/makingbl_1
37,[압생트] 녹색의 요정은 '고흐'에게 녹색악마로 변하였다.,향수 · 뷰티,"19세기 후반 유럽국가들의 예술가들에게 엄청난 사랑을 받았던 술, '압생트' 향수 프로젝트",https://tumblbug.com/absiinthe
38,"인류에게 고하는 가장 화려한 작별, <잊혀진 것들의 도시>",출판,"지친 마음을 위로해 주는 환상 동화, 
일러스트레이터 산호 작가와의 특별한 콜라보",https://tumblbug.com/il_inching
39,파리와 기억의 지속,향수 · 뷰티,영화 '미드나잇인 파리'의 모티브된 향기들을 저와 함께 만나보아요. ,https://tumblbug.com/markcollectionperfume2
40,웹툰 <퀴퀴한일기> 단행본 & 캘린더 & 다이어리 제작!,웹툰 · 만화,"다음웹툰 <퀴퀴한일기> 단행본 3-4권과 2022년 캘린더, 다이어리가 제작됩니다.",https://tumblbug.com/2022_2b
41,당신만 초대받았어요. 비밀의 유니콘 마법 포션 향수,향수 · 뷰티,근심 걱정을 날려주는 아기유니콘의 마법 포션 3종 향수,https://tumblbug.com/unicornperfume
42,네이버웹툰 <당신의 과녁> 1-5권 완결판 단행본 제작,웹툰 · 만화,네이버웹툰 <당신의 과녁>의 완결까지의 분량이 단행본 1-5권까지 제작됩니다.,https://tumblbug.com/gotaeho
43,"<ANCIENT KOREA> 금관의 시대, 고대 한복의 멋",출판,"화려한 금관과 세련된 장신구, 고대 한복의 멋을 그려낸 [아트북]과 [엽서북] [포토카드]",https://tumblbug.com/ancient_korea
44,새해엔 우리 <희망을 버려요>!! 염세주의자를 위한 그림책,출판,그로테스크하고 귀여운 책. 고단한 어른을 위해 만들었지요. 염세력 테스트도 해보세용! :),https://tumblbug.com/giveup
45,"세레노 정규 5집, MY WAVES",음악,"세레노 정규 5집, MY WAVES",https://tumblbug.com/sereno5
46,"세상에 남기는 나의 마지막 기록, 유서 노트",출판,회고와 죽음에 관한 질문에 답하고 유서를 작성하는 노트입니다.,https://tumblbug.com/si-dam
47,"1인 가구 생활백서, <혼자서도 잘살 수 있어!>",출판,1인 가구에게 필요한 정보와 낭만을 담은 가이드북,https://tumblbug.com/life_is_good
48,"웹툰, 일러스트를 위한 헤일로 후광과 문양 브러쉬!",웹툰 리소스,"헤일로 브러쉬, 키라키라 브러쉬, 문양 패턴 브러쉬, 프레임을 만나보세요!",https://tumblbug.com/gh03
49,친절한 미디 작곡 입문서 <비트메이킹 1:1 레슨>,출판,개인 레슨을 받는 듯한 친절한 비트메이킹 입문서. 어려운 이론은 덜고 핵심만 채웠습니다.,https://tumblbug.com/beatmakinglesson
50,후가공 박을 한 곳에 담다! 2022 쿠르즈 컬러 시스템,디자인,"박가공 디자이너의 필수 디자인 도서!
대한민국 박컬러가 95%이상 담긴 호일 컬러 샘플북",https://tumblbug.com/kurzcolorsystem
51,QR을 찍으면 영상으로 해석해 주는 타로카드 <타로메이트>,디자인,카드를 뽑고 QR을 스캔해 주세요. 8년 경력의 타로 마스터가 모든 운을 해석해 드립니다.,https://tumblbug.com/selftarotcard
52,"1~4인까지, 협동 타이쿤 [Turn the Line!]",디지털 게임,토끼 알렉스와 동료들을 주인공으로 1~4인까지 플레이 가능한 협동 타이쿤 게임입니다.,https://tumblbug.com/turntheline
53,[달콤하지만 당이 1g이하!] 저당 햇땅콩 카카오 그래놀라,푸드,"국산 원물을 제품에 에센스로 사용하는, 추수의 두번째 수확물 ""땅콩 카카오 그래놀라""",https://tumblbug.com/choosoogirok
54,"로판에 어울리는 아르누보, 바로크풍의 프레임과 패턴, 문양",웹툰 리소스," 그림에 자연스럽게 스며들고, 돋보이게 해줄 바로크/아르누보풍의 프레임과 패턴 문양 세트.",https://tumblbug.com/50frame
55,종이로 옮겨간 플레이리스트 [뮤직 다이어리],디자인 문구,"흘러가는 것들은 기록하지 않으면 잊혀지기 마련입니다
좋아하는 음악과 감상을 기록해보세요",https://tumblbug.com/lp_playlist
56,모두의 추리로 완성되는 마피아 게임 [죄수들의 밤] ,보드게임 · TRPG,"사회자없이 플레이어들의 추리로 진행하는 마피아 게임, [죄수들의 밤]입니다",https://tumblbug.com/prisoner
57,포토샵과 일러스트레이터로 세상 모든 굿즈 만들기,출판,포토샵과 일러스트레이터로 세상 모든 굿즈 만들기 전자책 PDF ,https://tumblbug.com/everygoods
58,"기획자를 위한, 의한 영감노트 ""I am into____""",디자인 문구,일상에서 얻은 영감을 바탕으로 이이디어를 구체화할 수 있는 기획자 노트 ,https://tumblbug.com/beintoart
59,"내 방안의 작은 불멍, 연기폴폴 화목난로",홈 · 리빙,멍 때리는 것 조차 시간과 장소에 구애받을 순 없잖아? 언제 어디서나 향멍 불멍 때리기!,https://tumblbug.com/fishtree002
60,이 세상에 없는 꾸덕함! 홈카페를 완성할<모아 그릭요거트>,푸드,"안 먹어본 여성은 있으나, 한번만 먹은 여성은 없다!
치즈인가 요거트인가? 모아그릭요거트!",https://tumblbug.com/moagreek
61,"떡볶이 도감 업데이트할 준비! 신종 ""들깨떡볶이""",푸드,들깨로 다시 돌아온 극볶떡볶이,https://tumblbug.com/deulkkae_tteokbokki
62,모든 영린이들의 이유 있는 영어 자신감 프로젝트!,출판,"프로삼일러 탈출 첫걸음, 15day's",https://tumblbug.com/15days
63,2022년 수묵 담채 호랑이 탁상용 캘린더 2종 ,디자인 문구,"2022년 임인년 호랑이해를 맞이하여, 호랑이를 수묵 담채화로 그린 22년 캘린더 입니다.",https://tumblbug.com/tiger
64,반전매력! 순수하고 음란한 연인들의 앤디카드,보드게임 · TRPG,"알면서 모르는 척 하는 연인들을 위해 미친 수위를 자랑하는 질문 모음, 앤디카드",https://tumblbug.com/andycard
65,[weDIGIDOG]상업 내부 7종 모음,웹툰 리소스,[weDIGIDOG]상업 내부 7종 모음,https://tumblbug.com/digidog3d002
66,결혼과 이주가 함께 왔다 <거기까지 가서 그렇게까지>,출판,"결혼과 이주라는 환장의 콤비네이션을 겪은 세 여자가 LA, 세종, 김천에서 분투하는 이야기",https://tumblbug.com/threecities
67,"내손으로 만드는 전통 끈 제작기구 ""다회틀 DIY""",홈 · 리빙,우리의 전통 끈을 제작하는 기구 '다회틀' 입니다. 다회틀로 다양한 끈을 만들어보세요.,https://tumblbug.com/chaecie_dh
68,네이버웹툰 <독립일기> 자까 무드등 & 미니휴지통,홈 · 리빙,올 겨울 <독립일기> 자까 무드등과 휴지통으로 귀여움과 실용성을 모두 잡아보세요!,https://tumblbug.com/jaggamoodbin
69,"2022년을 더 알록달록하게, '색'다른 캘린더와 엽서",디자인 문구,2022년을 더 알록달록하게 즐길 수 있는 달력과 엽서를 준비했습니다.,https://tumblbug.com/dotty1stpjcf
70,매트리스 곰팡이 귀신의 탄생과 죽음의 추적,영화 · 비디오," 매트리스 곰팡이의 탐생과 죽음의 기록, 영화 <다섯번째 흉추>",https://tumblbug.com/hyoongchoo
71,버려진 유기동물들이 지켜진 아이들이 되도록:초코송이 굿즈,디자인,"버려진 유기동물을 위한 초코송이 굿즈 프로젝트:유리컵,스마트톡,키링",https://tumblbug.com/songyi
72,<금목서 > 세이렌의 노래 그 찬란한 아름다움,향수 · 뷰티,가을에 울려퍼지는 세이렌의 황금빛 노래 그 찬란한 아름다움,https://tumblbug.com/osmanthus
73,2022년 신간 <중국통용수어사전> 번역 발간 출시,출판,중국의 농인과 수어 관련 대표 전문 출판사에서 펴낸 4권 분량의 중국수어사전을 번역 출판 ,https://tumblbug.com/deafland
74,"로컬푸드의 변신; 안심하고 짜먹는 복숭아, 녹차밀크 튜브잼",푸드,"지역의 이야기를 담은, 건강하고 맛있는 '안심하고 짜먹는 잼' 잼플이 돌아왔어요! ",https://tumblbug.com/jample
75,중독자의 이상심리를 그린 실화 소설 ,출판,"사람을 망치기도, 성공시키기도 하는 이상한 중독 심리. 웃기지만 소름끼치는 실화.",https://tumblbug.com/addict
76,목공인의 필독서! 목공에 관한 모든 것을 담은 책,출판,목공에 관심 있는 사람들이 꼭 읽어야 할 목공 가이드북,https://tumblbug.com/woodwise
77,"음악을 가지다, <NFT>가 적용 된 음악을 소유할 기회",음악,피아노 연주 음반을 제작하고 [NFT]를 발행하여 소유권을 전달드립니다.,https://tumblbug.com/laeebly
78,"색이 말해주는 나의 감정, 감정카드 <컬러 유어 이모션>",보드게임 · TRPG,"색이 말해주는 나의 감정, 어른들을 위한 감정카드 <컬러 유어 이모션>",https://tumblbug.com/color_your_emotion
79,"안기고 싶도록 따뜻한 향기, 니티허그 향수",향수 · 뷰티,"포옹을 닮은 니트의 향, 니티허그",https://tumblbug.com/hugperfume
80,MZ세대의 진로 고민 워크북 <그래서 난 뭐하지?>,출판,취업은 포기했다! 그런데 내 인생은 어쩌지? 그래서 난 뭐하지? MZ세대 진로 고민 워크북,https://tumblbug.com/happy_carrerlife
81,앙큼한 소녀들의 필수템! 핑크빗치클럽 6공 다이어리 패키지,디자인 문구,핑비클 팸 취향 저격! 앙큼한 소녀들의 갓생을 책임질 6공 다이어리와 굿즈들,https://tumblbug.com/vivinos
82,나만의 향을 담다 : 스톤디퓨저 [담향],홈 · 리빙,나만의 향을 담는 세라믹 스톤디퓨저,https://tumblbug.com/sang_a_hada
83,전설의 체스 그랜드마스터 카파블랑카의 책 '체스의 기본',출판,전설적인 체스 그랜드마스터이자 제3대 체스 세계 챔피언 카파블랑카가 쓴 체스 책,https://tumblbug.com/capablanca
84,"불로장생을 상징하는 10가지의 물상, 십장생 노리개와 키링",잡화,"사슴,불로초,학,구름 십장생으로 이루어진 노리개 키링을 소개합니다.",https://tumblbug.com/calme_9
85,진짜 속마음이 궁금해? 투표게임 쓰리포!,보드게임 · TRPG,나를 알 수 있는 또다른 방법! 친구들과 게임을 통해 나를 발견해보세요!,https://tumblbug.com/34game
86,스케치업 웹툰배경 - 로판 대신전세트 Part - 2,웹툰 리소스,로판 웹툰에 필요한 대신전 혹은 황궁으로 사용 가능한 대신전세트 파트2를 제작합니다.,https://tumblbug.com/dollphin08
87,고~백 쿠키! 고백해!,푸드,"쫀득한 아메리칸 쿠키가 다시 돌아왔어요!
쫀득한 쿠키로 발렌 타인 데이에 고백해요!!",https://tumblbug.com/plaisir_cakemira_12
88,"버려진 오렌지 껍질에서 발견한 희망, 제3회 구지독립영화제",영화 · 비디오,아트하우스 모모에서 개최되는 GUJIFF의 제3회 <구지독립영화제 : Oinh>,https://tumblbug.com/3rd_gujifilmfestival
89,카카오를 70시간 맷돌에 갈아만든 찐 생초콜릿 케이크,푸드,싱글오리진 과테말라 카카오로 만든 빈투바(Bean to Bar)생초콜릿 케이크,https://tumblbug.com/sanbo
90,한 달에 300만원 네이버 카페로 평생 월세받기,출판,네이버 카페로 평생 월 300만원 월세 받는 노하우를 담은 책 ,https://tumblbug.com/navercafebook
91,"악몽을 먹어드릴게요, '불가살' 중치막 로브",의류,"잠옷으로도, 외출복으로도. 전설의 동물 '불가사리'의 자수를 수놓은 한복형 멀티 라운지웨어",https://tumblbug.com/bulgasari
92,이번 겨울 포근하게 안아줄 사과 블렌딩티 <허그미애플티>,푸드,"달콤한 사과와 대추 깔라만시로 맛있고 건강한, 추위 타는 나를 위한 무첨가물 과일 블렌딩티",https://tumblbug.com/hugmeapple
93,나 요즘 어떻게 지내? 나에게 답하다. <셀프카운슬링북>,출판,'나'를 잊고 살아가는 나에게 Self Counseling Book으로 나를 찾아주세요.,https://tumblbug.com/selfcounselingbook
94,커피 사용설명서? 커피 운영 A부터 Z까지,출판,"커피도 설명서가 필요? 커피 이론부터 실무까지, 커피 운영도 한 눈에 보는 프로젝트",https://tumblbug.com/kumjac003
95,[웹툰 배경] 당신을 위한 주거공간 패키지,웹툰 리소스,"원룸부터 펜트하우스까지! 올인원 ""가성비"" 주거세트 입니다! ",https://tumblbug.com/sssun1903
96,대학문학상 수상 창작극 '작자 미상 수정 배포 자유',공연,"가면 뒤에는 무엇이 있나? 가면 뒤에는 이야기가 있지. 오래 전, 정말 오래 전의 이야기.",https://tumblbug.com/freelyunknown
97,"새해 소망을 띄워봐요 제주바다에, 유리 문진과 달력",사진,"일상 속 유랑, 제주 바다를 담은 유리 문진과 달력&패브릭포스터를 얼리버드가에 만나보세요!",https://tumblbug.com/ilang1
98,풍경에 풍경을 담은 <풍경종과 패브릭 포스터>,홈 · 리빙,"풍경종과 작은 행복의 순간, 그 풍경을 담은 패브릭 포스터",https://tumblbug.com/atodesign
99,스케치업 자연물 3종,웹툰 리소스,스케치업을 이용해 자연물을 표현하였습니다.,https://tumblbug.com/dfsfsd
100,"일러스트, 웹툰을 위한 아르누보풍 유니크 브러쉬",웹툰 리소스,아르누보 베이스의 클립스튜디오 브러쉬입니다. 다양한 소재의 브러쉬를 만나보세요.,https://tumblbug.com/dohwaseo
101,호기와 려니의 주황빛 청주여행 <청주화투>,보드게임 · TRPG,호미골에 사는 흑호랑이 호기와 금거리 토끼골에 사는 려니의 주황빛 청주여행 <청주화투>,https://tumblbug.com/cheongjuhwatu
102,나랑 손씻으러 가지 않을래? 너를 위해 준비했어 '캡슐솝',향수 · 뷰티,언제 어디서나 한 개씩 꺼내어 간편한 손씻기 가능한 캡슐솝,https://tumblbug.com/suusu
103,"2022년, 꽃길만 걷자! 조선의 꽃을 담은 [복조리백]",잡화,"눈앞에 펼쳐진 조선의 꽃밭, 19세기 화조도의 꽃들을 담은 미니 복조리백",https://tumblbug.com/giustobag2022
104,믿고쓰는 샴푸바! 환경과 두피를 생각하는 비건 고체 샴푸,향수 · 뷰티,소중한 당신의 두피와 하나뿐인 우리 지구를 위해 비건 샴푸바로 바꿔보세요!,https://tumblbug.com/theveganglow21
105,아르누보 시그림책<멀고도 가까운 노래들>1900년초판 복간,출판,아르누보 시그림책 <Songs of Near and Far Away> 1900년 초판 복간,https://tumblbug.com/songs_of_near_and_far_away
106,"함께 써내려가는 당신의 유서, 아포피스",디지털 게임,"가상의 인물과 함께 책으로, 앱 서비스로, 당신의 유서를 함께 써 내려가보세요",https://tumblbug.com/apophis
107,"음양사 아베노 세이메이의 비전, 점사략결의 최초 완역본",출판,음양사 아베노세이메이의 비급 점사략결,https://tumblbug.com/onmyodo
108,당신 뇌를 200%가동할 신약?[좀비런:Limitless],보드게임 · TRPG,"좀비런 키트는 실감나는 증거품, 모바일, SNS로 즐기는 좀비스릴러 추리게임 키트입니다.",https://tumblbug.com/zrno3
109,"지금 이 순간의 감정을 담은 다이어리, <EMO-MENT>",디자인,"나도 나를 모르겠어! 생각이 많아도 너~무 많은 
'프로 감정기복러'를 위한 필수 아이템",https://tumblbug.com/emo-ment
110,술에 우리는 블렌딩티 [리큐르티],푸드,"술을 즐기는 새로운 감성을 느껴보세요.
술에 우리는 블렌딩티-리큐르티",https://tumblbug.com/liquortea
111,[Interpret nature] - 자연을 해석하다.,향수 · 뷰티,"[소나무의 솔 잎에서 뿌리까지의 향기]
[수선화의 피어나는 과정] 향으로 표현하다.",https://tumblbug.com/boonbxxn
112,다시 모인 직장인들의 사진 이어달리기 <사진으로 바톤터치>,사진,대학교 시절 사진동아리 '서광회' 사람들이 다시 엮어가는 <사진으로 바톤터치>입니다.,https://tumblbug.com/photo_baton_touch
113,"<일본에서> 좋은 소재로 바르게 만든 안경 99,000원",잡화,이번 프로젝트 컨셉은 어두운 밤 하늘에 밝은 빛을 뽐내는 달빛처럼 따뜻한 안경입니다.,https://tumblbug.com/jia_ache
114,교육 소외 국가 어린이에게 동화책을 선물하는 윙윙패키지,디자인 문구,교육 환경이 열악한 국가 어린이들에게 동화책을 선물하기 위한 윙윙패키지 펀딩입니다!,https://tumblbug.com/wingwingbook
115,딱 1년만 책 읽고 쓰기 - 오롯이 나를 위로하는 시간,디자인 문구,"딱 1년만 책 읽고 쓰기 - 오롯이 나를 위로하는 시간
은둔이 필요한 나에게 주는 선물",https://tumblbug.com/gabza_proj1
116,새해 액운을 무찌르는 나만의 수호신- 오방색 플라옥노리개,잡화,"플라스틱을 재활용한 노리개
음양오행에 맞춰 나의 기운을 보완해주는 업사이클링 노리개",https://tumblbug.com/leesle-plaok
117,"미안,.내가 붕어빵 다 먹었다옹. 먹보냥 에어팟케이스",잡화,에어팟에 고양이가 입주했다옹.. 귀여워옹...,https://tumblbug.com/poundcat15
118,"아기자기한 정원사 트럼프 "" 가든 트럼프 """,보드게임 · TRPG,"꼬마 정원사들의 아기자기한 트럼프, "" 가든 트럼프""",https://tumblbug.com/gardencard
119,진정한 사랑과 행복을 찾아서 <True Love>,출판,[truelove]의 입체북 동화책 프로젝트,https://tumblbug.com/oklove
120,초능력자들이 사는 곳<도시>,디지털 게임,불길하고 새하얀 도시에 초능력자들이 살고 있습니다. 미스터리 어드벤쳐 게임 <도시>,https://tumblbug.com/_dosi
