,title,category,intro,url
2066,[스케치업 배경] 마녀 사관학교에서 사악함을 뽐내보세요!,웹툰 리소스,신비로운 거대 나무 위로 지어진 마녀들의 공동체 건물입니다.,https://tumblbug.com/parko03
2067,과감한뮤지컬 : Kick The Bucket,공연,과감한인생의 초대형 버킷리스트 프로젝트! <과감한뮤지컬 : Kick The Bucket>,https://tumblbug.com/kickthebucket
2068,동시통역사들은 어떻게 어학의 달인이 되었을까?,출판,통역사들이 공개한 영어/일본어/중국어/러시아어 ... 학습법을 총정리해 드립니다.,https://tumblbug.com/interpreters
2069,말랑 조랭이떡 아붕이 인형이 왔어요!,캐릭터 · 굿즈,망상리 토끼들 두번째 봉제 인형! 말랑하고 의젓한 조랭이떡 아붕이를 데려가세요!,https://tumblbug.com/aboong
2070,"나의 수집품을 작품으로, 메탈 핀뱃지 프레임",캐릭터 · 굿즈,핀뱃지를 작품으로 만들어 보세요. 뱃지 수집가를 위한 알루미늄 소재의 액자입니다.,https://tumblbug.com/pinmetalframe
2071,"앵콜]카페인 걱정없이 가장 맛있는 차, 밤을 가볍게 마시다",푸드,"카페인 걱정없이 마시는, 가장 맛있는 블렌딩차에요.",https://tumblbug.com/lighteat_blendmoon
2072,[커피 향수] 카페 우나에 오신 것을 환영합니다.,향수 · 뷰티,커피 원두가 로스팅(roasting)되면서 펼쳐지는 고소한 향연,https://tumblbug.com/roasting
2073,여성의 몸을 잘 아는 간호사 자매가 만든 인견 사각팬티,의류,말려 올라가는 드로즈 와 속바지에 지치셨다면 시원한 인견 사각팬티를 한장 만 입어보세요!,https://tumblbug.com/lightwear10000
2074,중국향 웹툰배경 스케치업 모델링,웹툰 리소스,중국향 웹툰 배경 스케치업 세트입니다.,https://tumblbug.com/ubg1
2075,공연전시 현수막 업사이클링 [앙코르 프로젝트],디자인,앙코르 프로젝트와 함께 '환경보호를 실천하는 문화예술활동'에 동참해주세요.,https://tumblbug.com/encoreproject
2076,셜록홈즈2 : 신원미상자의 비밀,보드게임 · TRPG,셜록홈즈 보드게임 제 2탄! 기억력과 소거법으로 John doe를 밝혀내 보세요!,https://tumblbug.com/johndoe
2077,<타임 스토리즈>,보드게임 · TRPG,보드게임 <타임스토리즈>의 한국어화 프로젝트입니다.,https://tumblbug.com/timestories
2078,집사공감 프로젝트 : 고양이 모래 & 2021 캘린더 달력,디자인 문구,"집사님의 고충을 고려하여 만든 모래 프로젝트, 집사공감의 첫번째 공감이 시작됩니다.",https://tumblbug.com/jibsagg
2079,"다시 여기 숲, 언택트 DIY 힐링박스",홈 · 리빙,숲의 향기와 피톤치드를 집으로 배송해 드려요. 힐링박스에 힐링 재료를 정성스레 담았어요.,https://tumblbug.com/hongcamp_healingbox
2080,#01.궁궐시리즈 : 창덕궁 첫번째 돈화문과 인정전 까지,웹툰 리소스,스케치업 웹툰 배경 궁궐시리즈 첫번째 창덕궁 입니다.,https://tumblbug.com/jinobono01
2081,삶과 죽음의 경계를 넘나드는 열 가지 기담 「기요틴」,출판,"도플갱어, 지박령, 생령, 빙의, 귀접, 악마… 소름끼치도록 매혹적인 열 가지 기담",https://tumblbug.com/guillotine
2082,"언제, 어디서나 편하게 : 노트북 거치대 파우치",잡화,"노트북 거치대 파우치로 언제, 어디서든 편한자세로 노트북 사용을 해보세요:)",https://tumblbug.com/standingdog
2083,아롱롤의 대학 종합 병원,웹툰 리소스,웹툰 배경 스케치업,https://tumblbug.com/alongroll
2084,문화재단 입사와 업무의 모든 것 <오! 문화재단>,출판,문화재단 현직자들이 말하는 문화재단의 A-Z!! 문화재단 기획자들의 고군분투기!,https://tumblbug.com/5mun_culture
2085,드레스 프릴과 장식 브러쉬,웹툰 리소스,"프릴을 그리기 어려워하시는 분들이나, 빠른 마감을 원하시는 분들을 위하여 준비하였습니다.",https://tumblbug.com/frk01
2086,"오늘 밤, 날자 - 밤의 마녀들 TRPG",보드게임 · TRPG,2차 대전의 소련 여성 폭격 부대를 다룬 TRPG <밤의 마녀들> 번역 출간 프로젝트.,https://tumblbug.com/nightwitches
2087,"온세상의 신들, <이토록 다양하神>",출판,세계 곳곳의 다양한 신들을 소개하고 정리합니다.,https://tumblbug.com/variousgod
2088,"차가운 겨울, 따뜻한 향기 선물 '생활향수'",향수 · 뷰티,"차가운 겨울, 내 마음을 따뜻하게 녹여줄 뜨끈뜨끈한 5가지 향기를 선물해드립니다.",https://tumblbug.com/eastear3
2089,한나네보호소를 응원합니다.,예술,디자인상품으로 한나네보호소를 후원합니다.,https://tumblbug.com/happydream
2090,일레븐 스케치업 05 - <한옥주택 & 한옥마을>,웹툰 리소스,일레븐이 제작한 웹툰제작에 도움이 되는 배경을 제공하기 위한 프로젝트 05,https://tumblbug.com/0115
2091,깊어져만 가는 악의를 이겨낼 수 있나요? <악인>,보드게임 · TRPG,"한순간 정체가 변화하는 신개념 마피아 보드게임!
웹툰 '자작 보드게임 동아리'의 첫 펀딩
",https://tumblbug.com/ak-in
2092,"메이플월드를 추억하는 테마 패브릭 퍼퓸 미스트, 메탈스티커",향수 · 뷰티,메이플월드에서 만난 캐릭터들과 감명 깊었던 장면을 ‘향기'에 담아 공유합니다.,https://tumblbug.com/maple_scent
2093,"설선물, 어썸한 누가크래커를 부탁해",푸드,"건강한 수제간식, 누가크래커",https://tumblbug.com/awesomenewyear
2094,마음과 지갑을 여는 11가지 협상법,출판,"마음과 지갑을 여는 11가지 협상법, 그 모든 노하우를 40 페이지 전자책에 담았습니다.",https://tumblbug.com/20200607
2095,100가지 남성 정장 포즈 모델링,웹툰 리소스,다양한 구도를 체크해볼 수 있는 남성 정장 포즈 모델링입니다.,https://tumblbug.com/12128282
2096,"포근포근한 스니커즈를 굽다, <슈크림 & 베이글>",잡화,가족끼리 만든 포근한 스니커즈! 슈크림과 베이글을 소개합니다:),https://tumblbug.com/crafterkb
2097,호탐의 탐나는 툰하우스 프로젝트_01 : 주거환경 인테리어,웹툰 리소스,웹툰을 위한 스케치업 배경 제작 프로젝트,https://tumblbug.com/toonhouse
2098,"멜론 덕후를 위한 리얼, 멜론 향수",향수 · 뷰티,맑고 풋풋한 향기! 달콤한 향이 부드럽고 은은하게 오래 남는 멜론이 향수로 탄생했습니다.,https://tumblbug.com/melonperfume
2099,"[심리상담] 어른이를 위한 신비한 상담소, 인간관계 편",출판,어른이를 위한 신비한 상담소는 인간관계 속에서 좀 더 행복해질 수 있는 방법을 제안합니다.,https://tumblbug.com/mindway02
2100,발매트를 완성하다. 발수건이 달린 멍멍이 발매트!,홈 · 리빙,욕실 앞의 새로운 인테리어. 콘타디자인이 만든 발 매트 연구의 집대성!,https://tumblbug.com/contadesign
2101,스케치업 웹툰 배경 [내 맘대로 조립식 던전],웹툰 리소스,사용자가 직접 조립하여 사용할 수 있는 커스텀 형태의 판타지 던전 배경 3종 입니다.,https://tumblbug.com/dontdraw05
2102,마블의 모든 것! <마블 백과사전 개정판 2019>,웹툰 · 만화,2019년 최신 버전으로 돌아온 <마블 백과사전 개정판>을 만나보세요 :D,https://tumblbug.com/marvel80th
2103,프랑스 락다운 일상을 그린 실키의 <버드박스>,웹툰 · 만화,#역병의시대 #외출은금지 같은 장소지만 조금씩 다르게 흘러가는 매일을 담은 그림책,https://tumblbug.com/silki_birdbox
2104,"세상에 없던 새로운 신발, '에어 라텍스 샌들'",잡화,키치오브제는 친숙한 사물들을 키치오브제만의 가치관으로 재해석하여 세상과 소통하길 바랍니다.,https://tumblbug.com/ko1
2105,전통의 숨결을 가방에 덧대다 _ 베가BAG,잡화,"전통을 근간으로 새로움을 디자인하는 家, 베가수의 깊이있는 아름다움_베가BAG입니다.",https://tumblbug.com/baegasu
2106,{ 프로그래밍 세계의 고양이 } 티셔츠 & 스티커,의류,트라이캐치의 첫 번째 프로젝트: 프로그래밍 세계에 빠져버린 고양이,https://tumblbug.com/trycatch_ver1
2107,"알면 안되는 곳, 그러나 알아야하는 곳: 학대피해아동 쉼터",캐릭터 · 굿즈,"가정학대의 현장에서 구출된 아이들이 보내지는 곳, 학대피해아동쉼터를 후원합니다.",https://tumblbug.com/borapansy
2108,소녀들에게 따스한 봄을 선물해주세요 : 위안부 뱃지 손거울,캐릭터 · 굿즈,뱃지와 손거울의 판매 수익금을 일본군 성노예 문제해결을 위한 '정의기억재단'에 기부합니다.,https://tumblbug.com/neulbom
2109,서울의 3년 이하 퇴사자의 가게들,출판,<서울의 3년 이하 퇴사자의 가게들: 하고 싶은 일 해서 행복하냐 묻는다면?>,https://tumblbug.com/broadcally5
2110,신이 된 나의 4신 4색 로맨스! <신도 야근을 하나요?>,디지털 게임,신이 된 나와 절대 충성을 맹세한 사자들의 4신 4색 로맨스! <신도 야근을 하나요?>,https://tumblbug.com/meetngreet
2111,"아르테미스, 셀레네, 헤카테- 달의 세 여신들을 담은 반지",주얼리,그리스 로마 신화 속 달의 세 여신들의 이야기를 담아낸 천연석 반지입니다.,https://tumblbug.com/etoile_luna
2112,계란고양이 티셔츠,의류,버림받은 계란고양이들을 위한 티셔츠,https://tumblbug.com/eggcat
2113,"[번화가 필수세트] 낭만과 감성이 담긴, 신촌 로데오거리!",웹툰 리소스,"언제나 낭만과 따듯한 감성이 함께하며, 젊은 에너지가 넘치는 신촌 젊음의 거리! 주경/야경",https://tumblbug.com/mingzzup02
2114,스케치업 웹툰배경 - 주택가 A,웹툰 리소스,웹툰을 그리시는 작가분들을 위한 스케치업 배경 모델입니다 !,https://tumblbug.com/httpsblognavercomlnn0909
2115,"스케치업 웹툰 배경""역삼 테헤란로""",웹툰 리소스,팀 말랑코 입니다 역삼테헤란로 거리와 골목을 참고하여 제작하였습니다 많은 관심부탁드립니다.,https://tumblbug.com/malangco3
2116,"환영받고, 배웅받으며 [검은 길고양이 인식개선]",캐릭터 · 굿즈,[검은 길고양이의 인식개선],https://tumblbug.com/dotori
2117,[스케치업 웹툰 배경] 바다가 보이는 카페,웹툰 리소스,한적한 곳에 위치한 바다뷰의 루프탑 카페와 주변 풍경을 제작하고 있습니다.,https://tumblbug.com/cafeblue
2118,경성스캔들 – 평화와 폐허,웹툰 리소스,1910년~1950년 근대 경성시내와 한국식 정원이 있는 한옥을 배경으로 제작하였습니다.,https://tumblbug.com/skypic02
2119,핑케치업 말풍선창고,웹툰 리소스,클립스튜디오용 말풍선 약 60종!,https://tumblbug.com/pinketchup2
2120,"동양풍 환상세계를 구현하다, <동양판타지/무협 맵 브러쉬>",웹툰 리소스,동양판타지/무협 세계관을 편하게 만들 수 있게 도와주는 동양풍 판타지 지도 브러쉬 프로젝트,https://tumblbug.com/orientalfantasymapbrush
2121,웹툰&일러스트 작품을 위한 꽃 브러쉬,웹툰 리소스,웹툰&일러스트에 쉽고 퀄리티있게 사용 가능한 꽃브러쉬입니다.,https://tumblbug.com/one_flower00
2122,스케치업 웹툰 배경 - 중세저택 내부,웹툰 리소스,판타지 혹은 중세 시대를 배경으로 사용 가능한 저택 내부를 제작해 봤습니다.,https://tumblbug.com/dollphinn
2123,"방구석에서 즐기는 좀비스릴러 방탈출, 좀비런 키트!",보드게임 · TRPG,"방구석 좀비런 키트는 실감나는 증거물,웹,인스타로 즐기는 좀비스릴러 추리게임 박스입니다.",https://tumblbug.com/zrno1
2124,프랑스 음식 철학을 담아 정성껏 준비한 비건 베이커리,푸드,"프랑스의 식문화를 담은 특별한 미각 체험, 채식한끼 베이커리",https://tumblbug.com/hanggibakery
2125,"약사가 피로 회복하는 방법 ""이온"", 피로와 이온하세요",푸드,이온팀은 언제 어디서나 쉽고 간편하게 먹을 수 있는 에너지밸런스를 목표로 기획했습니다.,https://tumblbug.com/eon
2126,[유기견]아이오펫& 해피니스 유기견 의료지원 프로젝트!,캐릭터 · 굿즈,유기동물 의료지원을 위한 IoPET(아이오펫) 서포터즈들의 심쿵 프로젝트!,https://tumblbug.com/happinessiopet
2127,당신의 꿀잠을 위해 태어난 [슬리퍼],캐릭터 · 굿즈,잠순이들을 위한 '꿀잠인형' 슬리퍼! 당신의 꿀잠을 책임질 쿠션담요 & 디퓨져인형 입니다.,https://tumblbug.com/sleeper
2128,"월간커피, 과즙 가득 리치 맛의 새콤달콤 콜드브루 커피",푸드,'월간커피'라는 이름으로 매달 새로운 싱글 오리진 콜드브루 커피를 한정수량으로 선보입니다.,https://tumblbug.com/brewsbrothers23
2129,불꽃심장 10주년 및 은퇴 앨범,음악,피아노 음악 작곡가 불꽃심장의 10주년 기념 앨범이자 은퇴 앨범 펀딩 입니다.,https://tumblbug.com/fheart
2130,나는 익명이고 너를 조아해! 힐링아이콘 익명이 다이어리,디자인 문구,"매일의 계획, 생각, 일상을 담을 수 있는 익명이 다이어리를 만들고 싶었습니다.",https://tumblbug.com/ikmyeong2020diary
2131,전공서적보다 유익한 페미니즘 [더오우너 vol.1],출판,더오우너가 페미니즘 그래픽 작업을 업로드 한 1년 8개월의 기록을 모았습니다.,https://tumblbug.com/theowner_vol1
2132,하루 6블럭이면 시간관리 끝! 2021 블럭식스 플래너,디자인 문구,심플할수록 중요한 것이 보이죠. 하루 6블럭이면 충분해요. 블럭식스 강의와 플래너 입니다.,https://tumblbug.com/block6
2133,[커먼어스] 적어도 131번은 쓸 스퀘어백,잡화,"한두번 사용 하는 에코백이 아닌, 실용적이고 오래 사용할 수 있는 에코백을 만듭니다.",https://tumblbug.com/commonus_ecobag2
2134,헬페미게이머들을 위한 전국디바협회의 굿즈 제작,디지털 게임,게임내 여혐과 성차별에 반대하는 전국디바협회가 페미게이머들을 위해 굿즈를 제작합니다.,https://tumblbug.com/dva_association
2135,봄을 마셔요 <무카페인 꽃차 샘플러 ver.3>,푸드,"봄을 맞이하는 아름다운 방법, 카페인이 없는 꽃차 샘플러, 9종의 꽃차를 한번에 맛보세요!",https://tumblbug.com/flowertea
2136,"클립처럼 끼우는 귀걸이, 이어 클라이머",주얼리,"이어클라이머는 클립처럼 귓불에 끼워 고정하는 귀걸이로,클러치가 필요없어서 염증걱정도 없어요",https://tumblbug.com/hhardi
2137,"돌아온 곱창밴드, 지구를 구하러 왔다!",잡화,버려진 양말목의 따뜻한 변신: 사계절을 담은 곱창밴드,https://tumblbug.com/thinkingeco
2138,"올라가는 엔딩크레딧 위, 별처럼 쏟아지는 우리의 이야기",출판,대학생 영화잡지동아리 '엔딩크레딧'의 창간호 <<청춘>>입니다.,https://tumblbug.com/endingcredit
2139,나는 이모티콘으로 투잡한다,출판,대학생 이모티콘 작가 정한나의 [나는 이모티콘으로 투잡한다] 출간 프로젝트입니다.,https://tumblbug.com/0615
2140,'한복을 담은 실크 에코백',잡화,사라져 가는 을지로의 한복쟁이들과 함께 한복 빛깔을 가방에 담아보았어요.,https://tumblbug.com/color_by_7f
2141,"서울을 담은 2세대 데일리백, 서울리즘",잡화,"수납은 기본, 디자인 스트랩 포인트까지! 감각적인 2세대 데일리백을 만나보세요",https://tumblbug.com/seoulism
2142,인생을 닮은 전통 매듭 팔찌와 DIY 키트,잡화,전통 매듭 이수자 박형민 장인과 함께한 전통 매듭 팔찌와 전통 매듭 팔찌 DIY 키트,https://tumblbug.com/chiproject
2143,연출을 위한 경찰서,웹툰 리소스,연출은 물론 경찰서 자체를 배경으로 진행되는 웹툰에서도 사용 가능한 경찰서입니다.,https://tumblbug.com/quattro3
2144,"빛, 그리고 꽃을 좋아하는 당신에게.",홈 · 리빙,"Blossom lamp, 꽃을 꽂아 빛을 밝히는 테이블 조명입니다.",https://tumblbug.com/253226
2145,티라우스 저고리와 푸른바다 인견 허리치마,의류,더위를 씹어먹을 한복계의 공룡이 나타났다! 티라우스 저고리 + 인견 푸른바다 K랩 허리치마,https://tumblbug.com/nabim1
2146,판을 확 뒤집은 여성 예술가들과의 인터뷰 <예술가의 초상>,출판,틀을 깨고 경계를 허문 위대한 여성 예술가 25인의 인터뷰집을 번역출간하는 프로젝트입니다.,https://tumblbug.com/portrait_of_an_artist
2147,"노브라로 입는 편하고 예쁜 홈웨어, 프리찌 [S/S시즌]",의류,"노브라로 입는 편하고 예쁜 홈웨어, [프리찌]입니다. ",https://tumblbug.com/freezzi_ss
2148,[이런저런 잡화점] 리본이 어울리는 블라우스 + 리본SET,의류,리본이 어울리는 블라우스 + 리본SET,https://tumblbug.com/ribbonblouse
2149,풍년 바질 맛있게 소진하기,푸드,옥상을 가득 매운 바질 건강할 때 모두 수확하기 프로젝트 ,https://tumblbug.com/urbanbasil
2150,샤를 보들레르 탄생 200주년 초판본시집 <악의 꽃> 출간,출판,"샤를 보들레르 초판본 시집 악의 꽃, 보들레르와 마티스의 콜라보 악의 꽃 출간 기념",https://tumblbug.com/mirbooks
2151,섬세하고 탐스러운 꽃 리본 열매 브러쉬 소재,웹툰 리소스,작가님들을 위한 탐스럽고 섬세한 꽃 브러쉬를 준비중입니다,https://tumblbug.com/httpstwittercomrosabloom_
2152,"단,4g 깃털처럼 가벼운 안경 [플루매직 패킹 vol.1]",잡화,독일의 정말 가벼운 안경을 후원자 분들에게 제공하고자 준비하였습니다.,https://tumblbug.com/jiaotical
2153,밋밋한 머리에 화사함을 얹어 줄 화관 및 머리장식 브러쉬!,웹툰 리소스,"다양한 디자인의 머리장식 브러쉬와, 화관 브러쉬를 소개합니다!",https://tumblbug.com/gh02
2154,[새해선물세트]달빛내린 풍경을 마시는 달빛술잔&접시세트,홈 · 리빙,"겨울밤, 달빛을 담은 술잔 그리고 접시와 함께 운치있는 술자리를 즐겨보세요-",https://tumblbug.com/insoil_moonlight
2155,따뜻한 손과 마음으로 유기동물에게 사랑을 전하세요,잡화,"장갑과 목도리로 마음을 따뜻하게 하여, 유기 동물들에게 사랑을 전해주세요!!",https://tumblbug.com/dream1004
2156,"건강과 맛, 한식대가의 전통디저트! <큰나무집 궁중식혜>",푸드,30년 전통 큰나무집 궁중식혜! 사랑하는 나의 가족들이 안심하고 먹을 수 있게 만들었습니다,https://tumblbug.com/farmtree
2157,"내 마음을 접었다 폈다, '플라워 카드'",디자인 문구,"꽃이 활짝 펼쳐질때, 사랑하는 사람에게 마음이 전달되도록 구조화하여 제작했습니다.",https://tumblbug.com/abjection
2158,<유섬> 알록달록 초상화,예술,오일파스텔과 수채화로 그리는 알록달록 초상화입니다. 스티커와 메모지도 함께 드립니다.,https://tumblbug.com/usum
2159,DMZ청정지역에서 자란 목련꽃차로 여러분의 건강채워보세요.,푸드,최대 3~4번까지 우려 마실 수 있는 청정지역에서 자란 목련꽃잎차를 카페인 대신 즐겨보세요,https://tumblbug.com/dmzmagnolia
2160,<나도 몰라서 공부하는 페미니즘> 정식 단행본 출간,출판,‘나도 몰라서 공부하는 페미니즘: #페미툰’이 단행본으로 정식 출간하게 되었습니다.,https://tumblbug.com/femitoon
2161,성우 유닛 '동네 오빠'의 음반 제작,음악,우리 동네에도 이런 오빠 한 명쯤은 있을걸?! 인기 성우 6인의 오리지널 음반 제작 프로젝트!! ,https://tumblbug.com/6voice
2162,삿된 것을 물리는 힘. 사인검 악세서리,잡화,"한국의 명검인 사인참사검의 진언문과 별자리를 반지와 팔찌, 키링, 펜대에 적용했습니다.",https://tumblbug.com/sainacc
2163,[웹툰]번화가 도시풍경 (지하차도)_스케치업,웹툰 리소스,지하차도가 있는 번화가 도시 배경입니다.,https://tumblbug.com/sempreblu2
2164,(투닥토닥 판타지) 스케치업 프로젝트 No.20_마왕성,웹툰 리소스,안녕하세요. 그래픽 디자인팀 투닥토닥입니다 :),https://tumblbug.com/jun31230_20
2165,"누구도 말하지 않은 진실, 『누가 노무현을 죽였나』",출판,노무현 전 대통령을 죽음에 이르게 한 그 진실을 파헤친다. “누가 노무현을 죽였나”,https://tumblbug.com/presidentroh
2166,자유로운 구동이 가능한 천사&악마날개를 소개합니다,웹툰 리소스,날개를 펼칠 수 있는 천사와 악마를 주제로한 클립스튜디오용 프로젝트입니다.,https://tumblbug.com/up_plus_006
2167,"당신의 마음에서 피어난 꽃, 전포롱의 <꽃의 이름으로>화집",예술,당신의 마음에서 피어난 꽃의 얼굴들을 그리고 책의 형태로 엮은 <꽃의 이름으로>화집입니다.,https://tumblbug.com/flower_of_jeonpolong
2168,양갓집 규수의 인싸가방 아씨복백 - 玄(블랙에디션),잡화,가죽공예와 전통매듭을 조합해 만든 전통적인 느낌을 담은 현대적인 데일리백,https://tumblbug.com/blackddommabag
2169,작은여우 <레레 인형>과 <모닝빵 카드지갑>,캐릭터 · 굿즈,꿈꾸는 베이커리를 운영하는 작은여우 레레 인형과 꿈꾸는 빵을 카드지갑 파우치로 만들었습니다,https://tumblbug.com/lelebakery_plush
2170,[굿즈] 바다 건너 우리를 살게하는 저마다의 방법 2,출판,뉴욕 파리 런던 서울 | 나의 상처를 치유하는 나만의 방법에 대한 모두의 이야기.,https://tumblbug.com/pe-per
2171,"테스토스테론을 감지해 사냥하는 인어, 《혈누인어》",웹툰 · 만화,혈누인어는 왜 남자만 골라 죽일까? 이들을 집중 취재한 모큐멘터리 단편 만화 프로젝트.,https://tumblbug.com/waterdemon
2172,"판타지 마법진 이펙트 3D소재(웹툰, 일러스트)",웹툰 리소스,클립스튜디오에서 사용할 수 있는 판타지 마법진 소재입니다.,https://tumblbug.com/magiccircle
2173,[스케치업 웹툰배경] 명품브랜드샵,웹툰 리소스,"옷, 가방, 악세서리 등이 진열되어있는 럭셔리 패션브랜드 매장 내부와 거리",https://tumblbug.com/luxuryfashionshop
2174,대한민국 문화유산 보드게임 <코리아마블 유네스코 편>,보드게임 · TRPG,대한민국의 소중한 문화유산을 배우고 지키는 <코리아마블 유네스코편>,https://tumblbug.com/kma
2175,[프로 일잘러 치트템] 인쇄 디자이너를 위한 마스킹테이프,디자인,디자이너들이 실무에서 많이 쓰는 인쇄 관련 꿀팁을 담은 마스킹 테이프 4종구성입니다 :D,https://tumblbug.com/maskingtape_fordesigner
2176,"페미니즘 :: 결혼반지 대신 ,비혼반지 어떠세요?",주얼리,BB탄을 결심한 여성들에게 건네는 비혼반지.,https://tumblbug.com/bbtan
2177,네이버웹툰 <냐한남자> 춘배 인형&키링 냥줍해주시오!,웹툰 · 만화,낭자! 춘배가 인형과 키링이되어 돌아왔오! 나를 냥줍하지 않겠소? 너무 귀엽다오!,https://tumblbug.com/love_chunbae_love
2178,"4월, 지금 우리가 계절을 살아가는 방법",푸드,농원과 저장고의 재료로 만든 인시즌의 레시피 중에서 당신만의 계절 테이블을 쉽게 만들어보자,https://tumblbug.com/simplyinseason
2179,"해중득화, 바다 가운데서 꽃을 얻다. 나전칠기 귀걸이&키링",잡화,"디아노이테의 나전사 프로젝트, 한국 고유의 전통 공예 나전칠기를 담은 귀걸이와 키링",https://tumblbug.com/dianoite_getflowersinthesea
2180,낭만적인 칵테일 상식을 소개하는 칵테일도감 THE MOON,출판,지친 당신을 위해 준비한 종합 칵테일 자료집.,https://tumblbug.com/cocktail_becrystal
2181,유어케이크 드로잉메모지,디자인 문구,"축하할 일이 있을 때 귀여운 케이크를 그려 선물해보세요, 유어케이크 드로잉메모지",https://tumblbug.com/yourcake
2182,위글위글 스마일위러브 플랫폼슬리퍼,잡화,유니크한 디자인과 편안한 착화감을 갖춘 오직 위글위글에서만 만나볼 수 있는 슬리퍼,https://tumblbug.com/smile_slipper
2183,"비혼 여성을 위한 Q&A 다이어리, 'B행일기'",디자인 문구,"287개의 질문, 72개의 정보로 365일을 가득 채운 비혼 여성 맞춤형 다이어리입니다.",https://tumblbug.com/b_hang_diary
2184,새로운 아티장 치즈와 샤퀴테리로 돌아온 치즈플로,푸드,"셰프들이 제대로 만드는 유럽의 장맛, 치즈플로의 아티장 델리와 함께 연말파티 어떠세요?",https://tumblbug.com/cheeseflo1129
2185,[스케치업 웹툰배경] 무협 사극 판타지배경,웹툰 리소스,[스케치업 웹툰배경] 무협 사극 배경,https://tumblbug.com/freeman02
2186,웹툰 스케치업 판타지 마을,웹툰 리소스,평화로운 작은 판티지 마을입니다.,https://tumblbug.com/yarn03
2187,유령이 숨어있는 오싹한 디저트볼과 아포카토용 콜드브루 세트,홈 · 리빙,도자브랜드 INSOIL x 커피브랜드 BREWS BROTHERS 가 함께한 한여름 프로젝트,https://tumblbug.com/creepyaffogato
