,title,category,intro,url
6126,무더위를 시원하게 날려버릴 아이스티가 나타났다!,푸드,무더위를 날려버릴 아이스티 코디얼,https://tumblbug.com/summerpunch
6127,"<태극기 3종 뱃지>, 과거로부터 현재까지의 역사를 담다.",캐릭터 · 굿즈,"태극기의 과거부터 오늘날까지, 그 치열한 역사가 담긴 <태극기 뱃지 3종> 세트",https://tumblbug.com/000002
6128,휴일의 편안함을 담은 바로크 진주 컬렉션,주얼리,바로크 진주로 제작된 귀걸이와 목걸이 입니다.,https://tumblbug.com/kikij_5
6129,언택트로 즐기는 진주남강유등축제 '추억을 담은 액자',예술,COVID-19로 취소된 진주남강유등축제를 언택트로 즐길 수 있는 추억을 담은 액자입니다,https://tumblbug.com/dahaebro_1
6130,7년차 중학생 웹소설 작가의 <내 맘대로 쓰는 웹소설>,출판,중학교 3학년 7년차 웹소설 작가의 웹소설 쓰기 노하우 공개를 위한 출판 프로젝트,https://tumblbug.com/leeseojeong
6131,터치오류 Zero 태블릿 <드로잉장갑>,잡화,특허출원한 품질 좋은 국산원단의 터치오류 제로 <태블릿 드로잉 장갑> 대량생산 프로젝트,https://tumblbug.com/drawing7
6132,일상을 향기로 가득 채워요! 대용량 룸패브릭 스프레이 3종,향수 · 뷰티,셋 중 하나는 취향저격! 일상을 향기로 채울 수 있는 아로의 룸패브릭 스프레이 3종,https://tumblbug.com/ahroroomfabric
6133,MAKF 판타지 문자 폰트 3,디자인,"만화, 일러스트 등에 사용 가능한 판타지 문자 폰트입니다.",https://tumblbug.com/makffont3
6134,"단순하지만 화려하게, '홀로그램' 타로 카드",디자인,"뱀, 꽃, 달, 장미. 이 4가지 요소를 활용하여 그려낸 타로카드(메이저카드)입니다.",https://tumblbug.com/hellojay
6135,창작 고양이 타로카드 '참을 수 없는 고양이 중독'-어비스,디자인,사랑스러운 고양이들을 아름다운 패턴으로 그린 타로&트럼프 카드입니다.,https://tumblbug.com/1216
6136,둘이 하나 되어 완성하다-레이어드set,주얼리,천연석 반지와 가드링,https://tumblbug.com/dear_nuri
6137,웹툰 연출을 위한 컬러 분위기 톤 100종,웹툰 리소스,"만화, 웹툰, 일러스트 등에 쓰기 좋은 컬러 분위기 톤 100종입니다.",https://tumblbug.com/wseon02
6138,정유년 AI극복 케익볼,푸드,정유년을 맞아하여 제작한 병아리.닭 케익볼 입니다:),https://tumblbug.com/cakeballs2
6139,미친 잔향을 자신합니다. 포근한 겨울의 향수 Comfy,향수 · 뷰티,딱! 일주일만 진행하는 Comfy 향수 앵콜 펀딩!,https://tumblbug.com/imlucy2
6140,"[한정수량 제작] 겨울왕국 경첩, 회전 룰렛, 체인 핀뱃지",캐릭터 · 굿즈,"겨울왕국 등장 캐릭터를 돌리고, 열고, 연결하는 여러 형태의 핀뱃지로 만나볼 수 있어요.",https://tumblbug.com/frozenbadge
6141,"빛을 담은 잉크, 자연을 담은 잉크",디자인 문구,"홀로그램,미러(거울),골드, 펄 색상의 새롭고 특별한 잉크 시리즈를 준비했습니다.",https://tumblbug.com/dominantink
6142,"잊지 말아야 할 독도의 그 이름, 우산도",캐릭터 · 굿즈,"우리의 역사 속, 독도의 옛 이름인 ‘우산도’를 여러분과 함께 기억하고자 합니다.",https://tumblbug.com/usando40240_1
6143,고양이 '수리노을' 라온이 망토 담요 (후드+반장갑),캐릭터 · 굿즈,유튜브 인기 고양이 채널 '수리노을'의 첫째 딸 라온이로 실용적인 망토 담요를 만들었어요!,https://tumblbug.com/surinoel
6144,"스페인 할머니의 요리그림책 샐러드편 ""야야레시피""",푸드,스페인친구에게 선물받은 할머니의 레시피노트를 그림으로 그립니다. 첫번째 샐러드이야기입니다.,https://tumblbug.com/yayarecipe
6145,연인과 함께 보는 공감100% 권태기극복 에세이툰 & 달력,출판,"현실고증 100% 권태기 극복 에세이툰 <그러니까 우리, 조금만 더 솔직해져보자>",https://tumblbug.com/079
6146,"비닐 랩을 대체할 아이디어, 패브릭 볼커버 ""다시씌우개""",홈 · 리빙,랩처럼 편리하게 그릇이나 접시에 덮어 음식을 보관할 수 있도록 돕는 패브릭볼커버 입니다.,https://tumblbug.com/74719697
6147,현대적이고 편안하다. 현바탕&현굴림,디자인,JTT가 선보이는 본문용 폰트시리즈입니다.,https://tumblbug.com/jttenth
6148,여름을 닮은 크리스탈 쥬얼리 DIY KIT,주얼리,여름을 닮은 크리스탈 쥬얼리 DIY KIT로 누구나 디자이너 악세서리를 만들 수 있어요.,https://tumblbug.com/crystal_acc
6149,5주 만에 발견! '일 자아' 찾기 워크툴 <굿-워커>,출판,굿-워커와 함께하는 딱 다섯 걸음. 나만의 보폭으로 걷는 worker의 길 찾기!,https://tumblbug.com/goodworker_s2
6150,"보자기 위에 금박으로 그린 윷 판, <금박 윷보>",보드게임 · TRPG,"보자기 위에 금박으로 그린 윷판, 매듭으로 엮은 윷말, 박달나무로 만든 윷 세트입니다.",https://tumblbug.com/yut_bojagi
6151,:툰피디:웹툰 오브젝트_슬럼가!!,웹툰 리소스,웹툰 작가님들을 위한 배경 및 오브젝트 스케치업 리소스 파일 입니다.,https://tumblbug.com/202006_slum
6152,옷주름 / 엑스트라 / 상황연출 506개,웹툰 리소스,"옷주름,동작 및 엑스트라 상황연출로 구성 된 웹툰제작용 스케치업 펀딩입니다.",https://tumblbug.com/clot
6153,"당신이 몰랐던, 진주",잡화,당신이 몰랐던 '진짜' 진주 이야기를 '귀걸이'를 통해 들려 드릴게요.,https://tumblbug.com/salt
6154,"추운 겨울 나를 감싸줄, ""프리미엄 Wool 후드 목도리""",잡화,램스울 소재로 보온성은 높이고 가격은 합리적인 후드 목도리입니다. 올겨울 따뜻하게보내세요.,https://tumblbug.com/20193302
6155,[기웃냥] '다 씻었냥?' 착한 고양이 수건,반려동물,다 씻었냥? 빨리 안 씻고 뭐하냥! 귀여운 냥이들이 샤워가 끝나기만을 기다리고 있어요.,https://tumblbug.com/finishower
6156,타로 다이어리로 기록하는 나의 일 년,디자인 문구,나의 일 년을 특별하게 기록하기 위해 타로 다이어리를 만들었습니다.,https://tumblbug.com/tarotdiary
6157,아곤: 영웅들의 항해,보드게임 · TRPG,<어둠 속의 칼날> 저자 존 하퍼와 숀 니트너의 신작 <아곤> 한국어판 출간 프로젝트!,https://tumblbug.com/agon
6158,시(詩)를 맛보는 색다른 전시 : 詩식회,예술,시(詩)를 맛보는 색다른 전시 <詩식회>,https://tumblbug.com/seeseek2
6159,출판직원이 필요해서 만든 햇살을 담은 클로드 모네 22달력,디자인 문구,"<Claude Monet> 2022 Calendar 프랑스의 햇살, 클로드 모네 작품 엄선",https://tumblbug.com/monet22
6160,★추억소환★ 하이틴 스타 되기 DIY 세트,디자인 문구,★추억소환★ 복고와 하이틴 감성을 담은 레트로 스타일의 DIY 굿즈를 만나보세요!,https://tumblbug.com/alohamoongu01
6161,"올 여름, 더욱 빛날 ‘나’를 위한 은반지 SET",주얼리,"여름에 착용하기 좋은, 온전히 나를 표현하며 빛내줄 은반지 SET",https://tumblbug.com/why1
6162,잠들기 전의 설렘 : 문자 메세지 야광 뱃지,캐릭터 · 굿즈,아날로그 감성이 드는 야광 뱃지입니다. 밝을 때 빛을 머금고 있다가 어두워지면 빛나요.,https://tumblbug.com/analogmessage
6163,헬페미니스트 선언 - '그날' 이후의 페미니즘,출판,새롭게 등장한 페미니즘 주체 '헬페미'에 대한 이야기를 책으로 출간하고자 합니다.,https://tumblbug.com/hellfemi
6164,‘매직 더 개더링’ 작가의 신작 전략게임! ‘버니킹덤’,보드게임 · TRPG,게임의 역사를 바꾼 '매직더 개더링'개발자 리차드가필드의 신작 '버니킹덤',https://tumblbug.com/bunny
6165,"앞, 뒤로 다양하게 입는 린넨원피스 <오렌지, 화이트>",의류,"앞,뒤로 착용 가능한 합리적 가격의 여름 린넨원피스. 이 옷과 함께 여름을 행복하게 보내요",https://tumblbug.com/rahrahkim2
6166,[동동이 웹툰배경]_액티비티의 천국 라오스 방비엥,웹툰 리소스,스케치업 웹툰배경 웹툰 활용의 폭을 넓힐 수 있는 라오스의 방비엥을 제작하게 되었습니다.,https://tumblbug.com/dongdongloas
6167,"공허한 청춘의 시선을 담다, '블루스, 노량진'",영화 · 비디오,"공허한 청춘과 위태로운 가족, 그 사이에서 방황하는 남매의 어느 하루. '블루스, 노량진'",https://tumblbug.com/bluesnrj
6168,퀴어페미니스트매거진 | 펢 | 2017특별판,출판,더 재미있고 더 불편하게! 퀴어페미니스트를 위한 액션 잡지 [펢] 2017특별판 #페미니즘,https://tumblbug.com/ferm2017
6169,귀여운 펭귄 '주디' 봉제인형 대망의 첫 데뷔,캐릭터 · 굿즈,"졸귀탱 펭귄 주디의 데뷔를 함께해요!
",https://tumblbug.com/judydoll
6170,"나의 두 번째 이름, 허수아비",출판,"컴퓨터 가게 사장이자 유튜버, 허수아비 아저씨의 뼈 때리는 인생 이야기에 우리 함께 풍덩!",https://tumblbug.com/scarecrow
6171,<남해에서 뭐 해 먹고 사냐 하시면 아마도 책방이겠지요>,출판,남해 책방 에세이 <남해뭐해>를 제작하기 위한 프로젝트입니다.,https://tumblbug.com/amado_books
6172,"수작업 러버즈를 위하여, 거북목 방지 우드데스크",홈 · 리빙,"자석 내장형 우드 데스크 작업대 펀딩,거북목 방지와 일러스트 작업 효율 향상이 목표입니다.",https://tumblbug.com/betterdesk
6173,"<4월 끝자락에> 봄 꽃 뱃지, 다시 한번.",캐릭터 · 굿즈,"<4월 끝자락에> 는 봄 꽃이 맞는 마지막 밤, 이라는 테마의 뱃지입니다.",https://tumblbug.com/springnight_again
6174,[레이스백] 구름처럼 가볍고 예쁘다,잡화,5월에 들기 좋은 레이스백,https://tumblbug.com/lacebag
6175,2D 동양판타지 탄막슈팅 로그라이트 <이라 IRA>,디지털 게임,"2D감성 쿼터뷰에서 펼쳐지는, 동양판타지 탄막슈팅 로그라이트 게임 <이라 IRA>입니다.",https://tumblbug.com/ira
6176,"일본 여행을 기다리는 [달력, 엽서북, 굿즈 패키지]",디자인 문구,일본에 여행 갈 수 있길 바라며 일본에서 찍은 사진으로 달력과 엽서를 만들었습니다.,https://tumblbug.com/summerpiecejp
6177,귀순이 : 마지막화,웹툰 · 만화,"네이버 베도 연재작 [귀순이]
마지막화 ",https://tumblbug.com/enica1
6178,"영어 노하우는 이제 마지막입니다. 가성비갑 ""명사독파""",출판,영어책의 역사는 '명사독파' 이전과 이후로 나뉜다!,https://tumblbug.com/nouns
6179,유기묘들의 행복이 되어주세요! <키다리 프로젝트 굿즈>,캐릭터 · 굿즈,"유기동물에 대한 지속적인 관심을 위한 폰케이스, 에어팟 케이스, 키링, 스티커",https://tumblbug.com/kidaristudio
6180,바람구두를 신은 피노키오,출판,한국 최초 인형극 에세이. 프랑스 샤를르빌에서 열리는 세계 인형극 축제와 함께 했던 순간들,https://tumblbug.com/pinocchio
6181,[이코니코니] 트렌디한 도심형 쇼핑몰&문화공간,웹툰 리소스,이코니코니의 웹툰 배경 프로젝트!,https://tumblbug.com/eecho
6182,"수납과 디자인 모두 놓치지 않은 가방, 스퀘어 토트백",잡화,수납과 디자인 모두 놓치지 않은 3 WAY 스퀘어 토트백입니다.,https://tumblbug.com/gy_gonggan
6183,[소프트 시티] 사람을 위한 휴먼 스케일 도시,출판,책 소프트 시티는 사람을 위한 건축으로 세계적 명성을 지닌 겔 건축사무소에서 기획했습니다.,https://tumblbug.com/softcity
6184,두 배로 즐길 수 있는 누빔재킷 '두 누빔 재킷',의류,"2온스 누빔에 양면 모두 입을 수 있는 리버서블 재킷, ‘두 누빔 재킷’을 소개합니다.",https://tumblbug.com/baerho5252
6185,잃어버린 총을 찾아서,영화 · 비디오,안중근 의사가 하얼빈 의거에 사용했던 총기와 동일한 모델로 하얼빈 의거를 재현하는 프로젝트,https://tumblbug.com/fn1900
6186,알러지걱정없는 귀찌 귀걸이,주얼리,"귀를 뚫지않아도, 알러지가있어도, 걱정없이 아프지않게 편안하게 착용할수있는 실리콘귀찌",https://tumblbug.com/negamadeacc3
6187,"아빠와의 기억을 연장하는 최고의 방법, 아빠일기",출판,"아빠에 대한 모든 것을 기록하고, 기억할 수 있는 책입니다.",https://tumblbug.com/your_ary3
6188,"옛날 동네, 시골 동네 웹툰 배경 스케치업",웹툰 리소스,"웹툰 배경 스케치업_ 옛날 동네, 시골 동네",https://tumblbug.com/storysoop1
6189,극동 러시아 여행 만화 <블라디보스톡 어때?>,웹툰 · 만화,"무화와 코코의 극동 러시아(블라디보스톡, 하바롭스크) 11박 12일의 여행기를 그린 만화.",https://tumblbug.com/what_about_vladivostok
6190,당신의 로맨스 판타지를 위한 무기,웹툰 리소스,로맨스 판타지에 유용하게 사용할 수 있는 무기들의 포즈집입니다.,https://tumblbug.com/oldweapon
6191,데일리 라이프 매거진 <미미 매거진> vol.3 커피,출판,미미 매거진은 당신의 '일상의 맛'을 찾아갑니다.,https://tumblbug.com/mimimagazine_coffee
6192,집에서 뭐하니? 집순이 맞춤형 굿노트 다이어리,디자인 문구,집콕이 익숙해진 대학생에게 방학 3개월 동안 소소한 힐링과 확실한 재미를 주는 다이어리,https://tumblbug.com/healingchiling
6193,이국적 문양 브러쉬 모음!,웹툰 리소스,다양한 상황에서 활용할 수 있는 매력적인 이국적 느낌의 브러쉬를 소개합니다!,https://tumblbug.com/gh01
6194,꽃차와 함께하는 북한이탈주민의 이야기,예술,꽃말을 활용하여 북한이탈주민의 아픔이 회복되기를 바라는 메세지를 전달하는 프로젝트입니다.,https://tumblbug.com/hwadam
6195,달콤한 마카롱 파티셰가 되어보자! 보드게임 [스윗홀릭],보드게임 · TRPG,세계적인 스위츠 대회가 열렸다! 달콤한 마카롱을 만들어 세계 최고의 파티셰가 되어 보자!,https://tumblbug.com/sweetholic
6196,건축학도가 만드는 웹툰 스케치업 배경 1탄 - 대학교,웹툰 리소스,"웹툰 작가분들의 쫓기는 마감을 도와드리는 웹툰 배경 스케치업 1탄, 대학교 배경입니다.",https://tumblbug.com/brokenwrist
6197,인기 웹툰 FOOLS 단행본/오디오드라마 제작,웹툰 · 만화,인기 BL웹툰 FOOLS(글/영하&그림/박담)와 오디오드라마 제작사 오디오코믹스와의 만남!,https://tumblbug.com/fools
6198,"직장생활의 안녕을 바라는 당신에게, [안녕노트]",출판,안녕노트는 건강한 직장생활을 위해 현재의 나를 돌아보고 미래의 나를 그리도록 돕습니다.,https://tumblbug.com/annyung_note
6199,북극곰야옹이 홈웨어,의류,은은한 스트라이프에 북극곰야옹이를 더해 유머와 귀여움을 놓치지 않은 홈웨어,https://tumblbug.com/polargramhomewear
6200,집순이의 핫 아이템! SOFF 담요 아직도 없어?,홈 · 리빙,최고급 퀄리티의 소재로 철학을 담아 만든 부드럽고 포근한 소프 담요 입니다.,https://tumblbug.com/soffblanket
6201,"참을 수 없는 귀여움, ""고양이"" 일러스트 플레잉 카드",보드게임 · TRPG,플레잉 카드 위를 자유롭게 뛰노는 귀여운 고양이 일러스트가 그려진 카드와 틴 케이스,https://tumblbug.com/playingcat
6202,일곱살 세인이가 쓱쓱 그린 '세인그림달력',디자인 문구,"세인이는 말을 늦게 시작했어요, 섬세하고 예민해서 혼자 그림그리는 시간이 많았답니다.",https://tumblbug.com/jaemjaem2013
6203,만년필에 담은 벽사 주문 '진언문 만년필',잡화,사인참사검의 진언문을 각인한 만년필을 제작합니다.,https://tumblbug.com/sainpen
6204,강인성의 첫 자작곡이자 두 번째디지털 싱글앨범 제작,음악,안녕하세요! 강인성입니다.강인성의 첫 자작곡이자 두 번째 디지털 싱글앨범이 준비중입니다.,https://tumblbug.com/991231
6205,에코백 10개를 대체하는 하나의 String Eco-bag,잡화,"마음도, 몸도 가벼운 true eco-bag!",https://tumblbug.com/dauerseoul
6206,"토종이 주는 기쁨, 연잎밥",푸드,"반찬이 없어도 맛있는 밥이 주는 기쁨, 건강한 토종 재료로 만든 연잎밥",https://tumblbug.com/leafrice
6207,어버이날 카네이션 뱃지,캐릭터 · 굿즈,어버이날을 위해 토끼같은 딸이 준비했습니다. 어버이날 3종 뱃지!,https://tumblbug.com/mothersday
6208,만화 우바우 펭이인형,캐릭터 · 굿즈,만화 우바우 펭이 인형입니다,https://tumblbug.com/itsun1
6209,"웹툰 액션이펙트_타격,기,바람,연기,충격,휙",웹툰 리소스,웹툰이나 만화작업에 들어가는 액션 이펙트를 작업했습니다.,https://tumblbug.com/anigun77
6210,스케치업 웹툰 배경 [돈드로우 5월 패키지 5종],웹툰 리소스,"매달 5건의 패키지의 선물을 구성하여, 저렴한 가격으로 웹툰 상생을 목표로 두고있습니다.",https://tumblbug.com/dontdraw01
6211,"작지만 존재로도 빛나는 당신을 위해 ""작은별 조명""",홈 · 리빙,"자신을 볼 여유가 없던 당신께 ""작은별 조명'을 제작했습니다.",https://tumblbug.com/tokistore
6212,한눈에 보이는 CMYK 컬러인쇄 가이드(수정판),출판,그래픽 소프트웨어에서 컬러를 지정할 때 믿고 참고할 수 있는 CMYK 컬러인쇄 가이드,https://tumblbug.com/cmykguide2
6213,"한 번 더 새로워진 자몽과 플루메리아의 조화 ""자몽메리아""",향수 · 뷰티,쌉싸름하고 상큼한 생자몽 + 달콤한 플루메리아 꽃향기가 가득히 더해진 향기의 향연,https://tumblbug.com/seili_03
6214,"한국스러움을 새로이 쓰다, '서울 노트북 데칼 스티커'",디자인 문구,태극과 서울의 랜드마크를 활용한 맥북/노트북 데칼 스티커,https://tumblbug.com/venho_seoul
6215,호로롱~ 호롱이 모찌인형 프로젝트!,캐릭터 · 굿즈,말랑말랑 뚠뚠이 호롱이의 첫 모찌인형을 만듭니다!,https://tumblbug.com/horong
6216,세상 모든 세균과 김서림을 물리쳐뿌까?,홈 · 리빙,"뿌까가 세상에 모든 세균과 김서림을 한꺼번에 물리쳐드릴게요. 문지르고, 닦아주면 깨~끄읕!",https://tumblbug.com/pucca
6217,1년간 14개 수어를 배우다. 금의환향 2021 수어캘린더,디자인 문구,수어 단어를 일러스트로 표현한 2021년 수어 캘린더로 일년간 14개의 수어를 배워보세요.,https://tumblbug.com/handspeak2021calendar
6218,필환경 숨쉬는 한지가죽으로 만든『클러치&쇼퍼백』,잡화,글로벌 패션기업 해리언이 선보이는 필환경 한지가죽 클러치&쇼퍼백,https://tumblbug.com/20200430
6219,<체리블라썸&실버백>봄향기 가득한 한정판 콜드브루키트,푸드,다크랩의 콜드브루는 집에서 직접 콜드브루를 간편하게 만들 수 있는 키트 입니다.,https://tumblbug.com/chococoffee
6220,<자본주의 히어로 Z> 단행본 제작,웹툰 · 만화,"더 두툼한, <자본주의 히어로 Z> 단행본 제작 프로젝트",https://tumblbug.com/heroz
6221,소복 소복 눈이 내린 부드러운 초콜릿 디저트,푸드,따뜻한 커피와 잘 어울리는 부드러운 초콜릿 디저트입니다,https://tumblbug.com/rarichocolate_winter
6222,탄생 이전의 시간 < 나는 셋 아니 넷 아니 다섯 >,출판,생명의 발생과 성장에 관한 미술가 국동완의 드로잉 41점과 글 41편이 수록된 아티스트북,https://tumblbug.com/40weeks
6223,프로젝트 문 라이브러리 오브 루이나 정출 축하 지하철 광고,디지털 게임,프로젝트 문의 라이브러리 오브 루이나 정식 출시를 기념하는 지하철 광고 프로젝트,https://tumblbug.com/pmlorsad
6224,맨부커상을 받은 첫 퀴어소설 『아름다움의 선』,출판,국내에 처음 소개되는 퀴어문학 거장의 매혹적이고 치명적인 사랑이야기,https://tumblbug.com/thelineofbeauty
6225,"나만의 특별한 길을 찾아서,<한의원 밖으로 나간 한의사들>",출판,"""Discover My Dream""을 모토로 한의사 21명의 인터뷰를 엮은 책입니다",https://tumblbug.com/mannadream4u
6226,향기전문브랜드 '셀러버'가 만든 고농축 섬유향수 5종,향수 · 뷰티,향기전문브랜드 '셀러버'가 만든 고농축 섬유향수 5종,https://tumblbug.com/celluver2
6227,한 손에 들어오는 엽서책! 포츄의 <베이커리 도감>,예술,가볍게 즐길 수 있는 디저트의 종류를 모아 일러스트와 함께 작은 엽서북으로 기획하였습니다.,https://tumblbug.com/potu_book
6228,오디션에 떨어지고 카페를 열었다,출판,개인카페 창업 과정을 땡땡씨의 시선으로 네모난 곳에 담았습니다.,https://tumblbug.com/ooo3dong
6229,한글 레터링 전시 <시원해지고싶다>,디자인,서촌의 한옥에서 열리는 한글 레터링 전시 프로젝트 <시원해지고싶다>,https://tumblbug.com/trying-to-be-cool
6230,우주에서 온 돌덩이 '운석반지',주얼리,지구밖에서 온 운석 '캄포델시엘로'를 세팅한 반지를 제작합니다.,https://tumblbug.com/meteoring
6231,머물고 싶은 어딘가 '썸웨어 ' 2021달력 오승만작가,예술,머물고 싶은 그 곳을 담은 ' 어딘가 somewhere ' 2021 포스터 달력입니다,https://tumblbug.com/somewhere
6232,일상 엑스트라 360인,웹툰 리소스,다양한 웹툰에 사용할 수 있는 일상 엑스트라 360인을 준비했습니다.,https://tumblbug.com/dailyextra
6233,"추워지는 겨울, 당신의 포근한 '인센스 라이프'를 위하여.",홈 · 리빙,마타인센스 그 두번째. 찬바람이 부는 계절과 어울리는 향기로운 인센스 스틱.,https://tumblbug.com/matta19fw
6234,"""한 해 가득 복을 선물하세요."" 2018 채색화 달력",디자인 문구,"열두장의 채색화로 채워진 달력세트와 편백나무 받침대, 고급 선물포장으로 구성되었습니다.",https://tumblbug.com/family_calendarproject
6235,고양이 꼬리 슬리퍼,캐릭터 · 굿즈,"7고양이와 집사, 크림히어로즈 유튜브 채널 구독자 70만 기념 고양이 꼬리 슬리퍼 & 뱃지",https://tumblbug.com/creamheroes_700k
6236,주얼리 그리고 여행를 사랑하는 당신을 위한 주얼리 파우치,주얼리,이제 당신의 소중한 주얼리를 전용 파우치에 보관하세요!,https://tumblbug.com/julette_jewelrypouch
6237,이어리니안의 유산 TRPG,보드게임 · TRPG,"아틀리에 레토르토가 만드는 순수 국산 오리지널 TRPG 시스템 ""이어리니안의 유산 TRPG"" 프로젝트 입니다",https://tumblbug.com/loerpg
6238,"누적 2억, 40개 이상 공모전 수상자의 합격 노하우!",출판,누적 2억 및 40개 이상 수상자가 들려주는 합격하는 공모전 기획편(입문자용),https://tumblbug.com/lyc306
6239,집순이&집돌이 외출하는 날! '홈스윗홈 에코백',잡화,집순이와 집돌이의 외출하는 날! 'Home sweet home 에코백'이 함께합니다.,https://tumblbug.com/homesweethome
6240,"까치까치 설날,수제 한과선물 세트 다식",푸드,"고소함으로 똘똘뭉친, 멜로잉의 5번째 프로젝트",https://tumblbug.com/malloing5
6241,"경계의 해빙, E3 아이덴티티 오브제 모빌",홈 · 리빙,아트디렉터 e3의 아이덴티티를 담은 스탠딩 아크릴 모빌,https://tumblbug.com/e3mobile
6242,"마음에 물을 줘요. 우울해도 괜찮아, 우울증 뱃지",캐릭터 · 굿즈,우울증 인식 개선을 위한 뱃지 프로젝트입니다. 수익금은 우울한 어린이들에게 기부합니다.,https://tumblbug.com/hope_for_depression
6243,"속편한 진짜우유, 어나더밀크",푸드,"속 편한 진짜우유 어나더밀크, 풍부한 영양과 낮은 칼로리,3 - 4시간의 포만감 까지",https://tumblbug.com/anothers
6244,SWOP: 판을 바꾸는 여성들,영화 · 비디오,"지워지지 않기 위한 기록의 첫 페이지 소셜아트크루 Eldorado, 그 항해의 시작",https://tumblbug.com/eldorado
6245,로컬 정체성을 살린 도시의 미래 <만드는 사람들의 도시>,출판,"소상공인, 디자이너, 메이커, 기획자, 연구자, 정책전문가가 함께 만드는 메이커시티 세운 ",https://tumblbug.com/mc_sewoon
6246,<자본주의 히어로> 단편집 제작,웹툰 · 만화,두툼하고 반짝한 <자본주의 히어로> 단편집 제작 프로젝트,https://tumblbug.com/__koo2koo2
6247,"맛은 제가 낼게요, 뿌리기만 하세요 <킥 잇 시즈닝>",푸드,모든 요리에 톡톡뿌려 맛과 풍미까지 완성! 세 가지의 시즈닝 솔트로 쉽게 요리하세요.,https://tumblbug.com/seasoningsalt
6248,"반려가족을 전통매듭으로 잇다, '반려견인식표&반려가족팔찌'",잡화,반려동물과 반려가족의 소중한 인연을 전통매듭으로 표현한 '잇다-반려가족'프로젝트입니다.,https://tumblbug.com/traditionalstar
6249,모히또가서 몰디브 한잔? 천연 라임 향기 가득 리얼 모히또,향수 · 뷰티,"상큼한 라임과 민트, 여름 더위를 날려줄 모히또 향기, 100% 리얼 모히또를 만나보세요.",https://tumblbug.com/louisneuf_mojito
